,text,category,polarity
3437,highly recommended.,miscellaneous,positive
2872,"But WARNING: to all those that use this site be weary, be very weary of recommendations.",miscellaneous,negative
3500,fine dining restaurant quality.,food,positive
4632,I had never had Edamame pureed before but I thought it was innovative and tasty (could've used a bit more salt).,food,positive
167,"The atmosphere is unheralded, the service impecible, and the food magnificant.",ambience,positive
2904,"You get what you pay for and with that logic in mind, Spice is a great place to grab some cheap eats and drinks in a beautiful setting.",food,positive
2057,We were a group of 8 and well seved.,anecdotes,neutral
2450,After the review I treked into Brooklyn.,miscellaneous,neutral
406,I've eaten at many different Indian restaurants.,miscellaneous,neutral
4837,But that is highly forgivable.,anecdotes,positive
3953,"I've been to this restaurant more than a dozen times and when I'm craving for Pho, Lemon grass chicken or Beef Cube on rice, this is the place to go.",food,positive
4608,Unbelievable.,anecdotes,positive
2514,But too far east!,miscellaneous,negative
2920,"Other than being a little crowded and a bit overpriced, the atmosphere is filled with energy (and the beautiful people of course) and the food was surprising good!",food,positive
1479,"Not sure where the previous reviewer, lonk, dined, but Saul is in a great neighborhood and has great food!",ambience,positive
2336,"From the spectacular caviar to the hospitable waitstaff, I felt like royalty and enjoyed every second of it.",service,positive
3811,"Worth it for a special occasion, or any time!",anecdotes,positive
4461,I have eaten there 3-4 times and the food was always good.,food,positive
2398,Just an odd group.,anecdotes,neutral
2414,The ambience is authentic and relaxing and we have always received attentive and prompt service.,service,positive
2313,Worth a visit.,miscellaneous,positive
2405,it is not consistent.,miscellaneous,negative
867,Maybe it was just an unintentional mistake but I've experienced the same with other restaurants so I don't appreciate such practice.,miscellaneous,negative
2496,"To begin, we were told there was a 30 minute wait and started to leave, when the hostess offered to call us on our cell phone when the table was ready.",service,conflict
3131,"The Halibut was too salty, dessert was so so (don't waste any of your calories) and service was poor.",food,negative
1530,This is my first time writing a review for a restaurant because the food and service was excellent.,food,positive
3824,Definitely a once a year treat that I look forward to around the holidays!,miscellaneous,positive
965,"I recommend the garlic shrimp, okra (bindi), and anything with lamb.",food,positive
2679,Old school meets New world.,miscellaneous,neutral
1056,"Saturday, Nov. 6th I had a group from work come in with about 35 people and the staff was amazing to accomodate us.",service,positive
4719,Maybe tomorrow ;-),anecdotes,neutral
3125,"Good to find a restaurant where the owners have some imagination and they have actually pulled it off, like in this case.",miscellaneous,positive
4715,I went to Amma after a friend recommended it.,miscellaneous,neutral
2202,"We actually gave 10% tip (which we have never done despite mediocre food and service), because we felt totally ripped off.",food,neutral
2115,The white bean brushetta to start was incredible and the pasta was phenomenal.,food,positive
2865,"Shockingly easy to throw a group dinner here: simple contract, deposit only to hold the date the entire 2nd fl mezz for our grp of 20.",miscellaneous,positive
1161,Definitely a neighborhood favorite.,anecdotes,positive
1812,Awsome Pizza especially the Margheritta slice.,food,positive
4366,I'm happy to have Nosh in the neighborhood and the food is very comforting.,miscellaneous,positive
4345,It is not a place for tourists or someone who has never dined in Bay Ridge.,anecdotes,neutral
3781,"At 6:30, we were the third party there.",anecdotes,neutral
1100,"It is the type of place to run into old friends and have a late, raucus dinner.",miscellaneous,positive
4036,I live a block away and go to Patsy's frequently.,anecdotes,neutral
2815,"Of course this atmosphere is lacking, but what do you expect from a 24 hour bagel place anyways?",ambience,negative
1617,I was so sad to read the bad reviews this place got!,miscellaneous,negative
3607,"Same owner as the guy who owns Typhoon, which is just down the street on St. Marks and 1st Ave.",anecdotes,neutral
757,Don't be fooled by crowds of people.,miscellaneous,negative
1352,It won't break the bank but I also wouldnt come back for the food.,food,negative
2542,"When he's not making authentic Neapolitan pizza in the open brick oven or lightly frying zucchini blossoms, he's visiting the regulars (a growing legion) and checking on newcomers.",service,positive
3825,Service is fast and friendly.,service,positive
4622,I'd highly recommend it for a special occasion -- it provides and intimate setting and nice service.,ambience,positive
4474,The service was great as well.,service,positive
3073,"The food was amazing, and the service was prompt and helpful, but not over-bearing or rushed.",food,positive
4106,I recommend that you try this hidden spot which will surely blowup very soon,anecdotes,positive
3997,"It can be a little confusing as to where one goes to order, but once the food is ordered, you are in for a treat.",food,positive
2036,Everything about this restaurant was special.,anecdotes,positive
3626,I would highly recommend this place to anyone looking for a casual atmosphere that whisks you away to the left bank of the river Seine.,miscellaneous,positive
2897,It's great to go for a quick lunch either alone or with a friend.,miscellaneous,positive
4234,The bar has various selections and the mixed drink special is a catcher! 2 for 1's.,food,positive
4196,Owner must have coem on this website to give himself credit.,anecdotes,neutral
2659,"We made early dinner reservations and were thoroughly impressed, reminds me of my grandfather, its old school Italian scenery with lots of fun stuff to admire.",ambience,positive
4289,"The staff makes you feel at home, the food is great and the atmosphere is WONDERFUL!",food,positive
513,This is a nice restaurant if you are looking for a good place to host an intimate dinner meeting with business associates.,anecdotes,positive
3557,"You can certainly find restaurants that offer a superior fine dining experience, but for superb food at reasonable prices, La Villa can't be beat.",food,positive
1031,The appetizing is excellent - just as good as Zabars Barney Greengrass at a reasonable price (if bought by the pound).,price,positive
2987,What an amazing meal and experience!,food,positive
4634,"When we notified him that he didn't mention the specials, he didn't apologize but let us know that we made a very good decision regardless.",service,negative
3036,I loved it.,miscellaneous,positive
4326,I cannot recommend OG more highly if I tried - check it out for yourself.,anecdotes,positive
2494,"Overall, excellent restaurant!",anecdotes,positive
1136,My boyfriend and I went there to celebrate my birthday the other night and all I can say is that it was magnificent.,miscellaneous,positive
4593,No you're going to go back because the food was good.,miscellaneous,positive
1184,"The dishes offered were unique, very tasty and fresh from the lamb sausages, sardines with biscuits, large whole shrimp to the amazing pistachio ice cream (the best and freshest I've ever had).",food,positive
399,The soup for the udon was soy sauce and water.,food,negative
3215,"Also, if you don't want to sit at a certain table, you don't have to!",service,positive
1630,The food is a diamond in rough -- the food is delicious and homemade with the perfect balance of herbs and tomatoes.,food,positive
1844,I've been to several places for Dim Sum and this has got to be the WORST.,miscellaneous,negative
3832,My husband and I enjoyed each of the 6 taste size portions and left completely full.,food,positive
3778,My sister says it reminds her of a restaurant run by high-school students who don't know what they are doing.,anecdotes,negative
3782,"At 6:30, we were the third party there.",miscellaneous,neutral
433,Finally!,anecdotes,positive
4116,Great pizza and fantastic service.,food,positive
383,even the wine by the glass was good.,food,positive
2870,What I didn't like was how the food came right after it was ordered.,food,negative
1820,"uni from maine vs california, sea vs freshwater eel) to get a good taste comparison.",miscellaneous,neutral
4078,"This is a great place to take out-of-towners, and perfect for watching the sunset.",miscellaneous,positive
1044,The food options rule.,food,positive
206,"I have tried to make reservations, but both times, the hostess didn't have my name.",service,negative
1661,We will definitely go back.,miscellaneous,positive
3447,It will be on my to do list the next visit to NYC.,miscellaneous,positive
3820,"I had a late dinner at Lucky Stike, a great name for a joint if ever I saw one.",miscellaneous,neutral
4428,The service is good and the resturant is clean.,service,positive
3593,"No food snobs allowed, this place is for people who appreciate good food.",miscellaneous,neutral
145,"Unfortunately, the food is outstanding, but everything else about this restaurant is the pits.",miscellaneous,negative
2983,"The first time I went, and was completely taken by the live jazz band and atmosphere, I ordered the Lobster Cobb Salad.",ambience,positive
574,One of the more authentic Shanghainese restaurants in the US definitely the best in Manhattan Chinatown.,anecdotes,positive
3736,We spent $200 in this place and left hungry and very disappointed.,anecdotes,negative
1597,"Skip Baroanda down the street (Eurotrashy, snooty and expensive) and check this place out!",miscellaneous,conflict
377,The food is great.,food,positive
1670,"The portions are now very small, the sauces are overly-ambitious usually inedible while the service is still good, the restaurant, due to its popularity, seems frantic.",food,negative
4222,"They're also friendlier here, especially the owner, Kenny.",service,positive
201,but overall i give it a 10,anecdotes,positive
600,Hurley's is like Cheers where everyone knows your name and they are ACTUALLY glad you came.,service,positive
155,Sapphire is the only Indian restaurant I go to when I'm in NYC.,miscellaneous,positive
1279,I definitely wouldn't go back.,anecdotes,negative
3796,Try sushimi cucumber roll.,food,positive
4149,Have been dozens of times and never failed to enjoy the experience.,anecdotes,positive
3416,"Service was devine, oysters where a sensual as they come, and the price can't be beat!!!",food,positive
2394,A cool place to hang with your friends for a couple of healthy drinks and desserts.,food,positive
1425,"Best Italian food I ever had (and being Italian, that means alot).",food,positive
329,My friends and I were on vacation in NY and was referred to Chance by a friend.,miscellaneous,neutral
9,"Not only was the food outstanding, but the little 'perks' were great.",service,positive
927,Went here last night and had a pleasant experience.,anecdotes,positive
1332,The sweet lassi was excellent as was the lamb chettinad and the garlic naan but the rasamalai was forgettable.,food,conflict
4832,it helps if you know what to order.,miscellaneous,neutral
3028,Salads are a delicious way to begin the meal.,food,positive
1680,"With so many good restaurants on the UWS, I don't need overpriced food, absurdly arrogant wait-staff who don't recognize they work at a glorified diner, clumsy service, and management that doesn't care.",food,negative
3345,The food there is so good that even to order out the wait is incredible.,service,negative
1872,"THe back garden sitting area is very pleasant, where you can see their personal herb garden.",ambience,positive
847,The waitress was very patient with us and the food is phenomenal!,food,positive
3448,Nothing better than buying a snapple for $3.25 too.,price,positive
3891,IT IS WHAT MODERN CUISINE IS ALL ABOUT.,anecdotes,positive
1762,I was very impressed by this low-key upper eastsider and their authentically thai cuisine!!!,ambience,positive
3311,"Service is friendly, prices are good - delivery time was a little slow, but for the way this pizza tastes, I'm willing to overlook it.",food,positive
2322,"If you're looking for a great meal at a decent price, go to Del Frisco's!",food,positive
3683,"though the service could be better (possibly due to more than one very large group in the house), it is very cordial and warm, as is the general clientele.",ambience,conflict
3490,"Found service above average, but that could be because we were 13 of us.",miscellaneous,positive
903,This place was not ALL THAT!,miscellaneous,negative
4841,"When we arrived at 6:00 PM, the restaurant was practically empty.",miscellaneous,neutral
4015,THe Pizza and wine were excellent-the service too--but what really MADE this place was the backyard dining area.,service,positive
4157,The jukebox plays everything from Italian Opera to The Strokes.,ambience,neutral
2522,"This place is cool enough to be in the East Village, but French enough to make you feel like you could be in a bistro in a back alley in Paris.",ambience,positive
1654,"Nha Trang, while being notorious for utter lack of comfort and decor, horribly slow wait staff and horribly quick meals, is one of the best vietnamese restaurants i've ever been to. the pho is delicious and comes with very fresh vegtables.",food,positive
3763,"Bravo, Blue Hill!",anecdotes,positive
3462,Right off the major deegan you get ladies from all over the city.,ambience,positive
745,The lobster sandwich is $24 and although it was good it was not nearly enough to warrant that price.,food,conflict
1085,I got enough reasons to keep coming back!!!,anecdotes,positive
3951,"When my husband and go there, we spend $60.00 (have LOBSTER TAILS UMMMMM need I say more) I can't say any more, it a place you'll never forget If you never go, you'll miss A Meal of your life time",price,positive
4648,"Delicious food, excellent service, and a pretty atmosphere make this a great choice for dinner and the $5.99 lunch buffet makes it an even better choice for lunch!",price,positive
945,"Orsay, is without a doubt one of the best values for authentic French food in NYC.",food,positive
3532,"Had 1 appetizer, 2 entrees and 2 cokes and the bill was ~$55.00, not including tip.",price,neutral
1330,"Everytime I decide to try another place on the UES, I get angry that I didn't just go to Zucchero Pomodori.",anecdotes,conflict
3325,The pizza was really good.,food,positive
3931,"I've eaten at Pizza Gruppo a few times, but more often I order delivery.",miscellaneous,neutral
3949,"When my husband and go there, we spend $60.00 (have LOBSTER TAILS UMMMMM need I say more) I can't say any more, it a place you'll never forget If you never go, you'll miss A Meal of your life time",anecdotes,positive
1081,We were not dissappointed in the least bit by this little gem.,miscellaneous,positive
1737,"While it's not Nobu, it sure is a great deal and you definitely will leave feeling satisfied and full.",food,positive
566,I recommend getting a reservation even though we saw people seated without one.,anecdotes,neutral
3574,"I would recommend Roxy's for that, but not for their food.",miscellaneous,positive
4121,"While this is a pretty place in that overly cute French way, the food was insultingly horrible.",food,negative
1389,I've been many time and have never been disappointed.,anecdotes,positive
4629,"Just because it's cheap does NOT mean the portions are small or the food is nasty, IT IS GREAT!",price,positive
1268,Went there with my wife and we had to wait for a table even though you could see there many that were empty with not reservation sigh on them.,service,negative
1778,"Not a typical pizza joint, but good for a low key and fairly cheap nice sit down dinner.",food,positive
4105,The service is fantastic.,service,positive
1973,"Chance is a small cozy restaurant, with a romantic feel to it, the decor is great.",ambience,positive
690,"He not only makes his own homemade mozzarella, but every pie is ultra fresh.",food,positive
4476,Another plus is most of the entrees are approx.,anecdotes,positive
1438,Took my sister here before attending a show one evening.,anecdotes,neutral
1936,"NO more reservations, expensive tips and annoying stuff.",service,positive
1673,"For the price, you cannot eat this well in Manhattan.",food,positive
3963,This is also where I was from.,miscellaneous,neutral
1558,Have frequented 'ino for several years and the food remains excellent.,food,positive
708,Surprisingly nothing could be further from the truth.,miscellaneous,positive
4258,The fried dumplings are GREAT!,food,positive
2245,"I have never eaten in the restaurant, however, upon reading the reviews I got take out last week.",anecdotes,neutral
3690,Service was very friendly.,service,positive
754,"For some reason, all the seafood on the menu was unavailable except for the Salmon.",food,negative
3413,I thanked my friend who recommended me this restaurant and will certainly recommend it to others.,miscellaneous,positive
4006,I recommend this spot to anyone who enjoys  fine cuisine at reasonable prices.,price,positive
193,The strong scents coming from the left and right of me negatively affected my taste buds.,anecdotes,negative
45,Will not be back.,anecdotes,negative
1442,Really.,anecdotes,neutral
4421,And their prices are very high - they actually think that they can get away with charging such prices for such terrible food and service!,food,negative
478,"With so many poor experiences to be had in the theater district, is truly an excellent find!",miscellaneous,positive
2231,"Guacamole+shrimp appetizer was really great, we both had the filet, very good, didn't much like the frites that came with, but the filet was so good, neither of us cared.",food,conflict
3332,A little crowded but they move that line really fast!,service,positive
111,Try the lasagnette appetizer.,food,positive
1809,"Great food, great prices, great service.",price,positive
1062,It seems like this is a place the locals like and the people working here liked it too.,anecdotes,positive
4199,Turned out there was full service upstairs and sat down.,miscellaneous,neutral
589,I went to Del Frisco's Friday night with my boyfriend for an 8:00 reservation.,anecdotes,neutral
3047,Prices too high for this cramped and unappealing resturant.,price,negative
3210,Incredible food at a very agreable price brings me back just about every other day to this authentic Thai restaurant.,price,positive
1539,The two star chefs left quite some time ago to open their own place.,anecdotes,neutral
893,Have been several times and it never dissapoints.,anecdotes,positive
3236,I've overheard comments from him to his employees that should not have been delivered in the dining area and I've been sitting there while he lectured another customer.,miscellaneous,negative
4020,"The waiters are sweet, the food is tasty and the bill is never too large.",service,positive
4736,"It might have been a little too spicy for my friend, which you can couteract with eat more rice and keeping water on hand.",food,neutral
2341,Definitely worth the trip to Battery Park City!,anecdotes,positive
3245,Just bring someone who speaks Cantonese because waiter may not understand you.,service,negative
3078,"Off the beaten path, this jewel of a restaurant shines just one block away from the plethora of 6th street Indian restaurants.",anecdotes,positive
4641,I've had to wait only a few times during lunch but this place is definitely worth the wait.,miscellaneous,conflict
1153,Get there before 7pm.,miscellaneous,neutral
336,"Eating in, the atmosphere saves it, but at your desk, it's a very disappointing experience.",ambience,positive
3614,The wine the service was very good too.,service,positive
2016,"Meanwhile, the bartender continued to pour champagne from his reserve after we had finished our bottle and we enjoyed an amuse of turnip soup with pureed basil, gratis.",service,positive
4118,We were seated outside and the waiter spilled red wine and hot tea on myself and my date.,service,negative
3567,"To speak of the Park Side, words can not describe.",miscellaneous,neutral
3366,The ambience is very romantic and definitely a good place to bring a date.,ambience,positive
1098,You cannot go wrong with this place.,miscellaneous,positive
3157,"and i have been around the block, to say the very least.",miscellaneous,neutral
539,"overall, a solid restaurant and at less than $40pp (including wine), a solid deal as well.",miscellaneous,positive
1026,Save yourself the time and trouble and skip this one!,miscellaneous,negative
667,The sangria was pretty tasty and good on a hot muggy day.,food,positive
1669,"Having not been home in the last 2 years may skew this reviewer a bit, but the food was tasty and spicy sans the oil that comes floating along at similar venues.",food,positive
1366,Be careful of portions - they're HUGE.,food,positive
287,Hats off to the chef.,food,positive
2700,This restaurant is such a great place.,miscellaneous,positive
4156,"Staffs are not that friendly, but the taste covers all.",service,negative
42,The seats are uncomfortable if you are sitting against the wall on wooden benches.,ambience,negative
2282,"Not cheap, but not that expensive either.",price,conflict
758,and there's no way out.,anecdotes,neutral
170,"The wait staff is friendly, and the food has gotten better and better!",service,positive
2439,enough said!,anecdotes,neutral
1552,my first time here was with my gf for our 12 month anniversary.,miscellaneous,neutral
920,"Searching to get out from the cold, freezing weather, we went into what we thought was a deli.",anecdotes,negative
3621,"Seriously, this is the best all you can eat in town- As everyone says, the Spicy Tuna hand rolls are the best- have 4 of these, and you've broken even.",food,positive
1559,Have frequented 'ino for several years and the food remains excellent.,anecdotes,positive
2900,LLOOVVE THIS PLACE.,anecdotes,positive
77,Worth visiting the 1st Ave spot because it is the original store.,miscellaneous,positive
3922,"The calamari comes with an incredible sauce, and the duck noodles are yummy as well.",food,positive
3970,The space is nice but when we order our drink we were in for a surprise.,ambience,positive
2264,Please save yourself the frustration.,miscellaneous,negative
2376,I am relatively new to the area and tried Pick a bgel on 2nd and was disappointed with the service and I thought the food was overated and on the pricey side.,service,negative
372,"Frankly, when you compare what you can have here for lunch, versus McDs or so many other sandwich shops in the city, there is no comparison.",food,positive
468,Something about them being busy with holiday party's.,miscellaneous,negative
4083,"You will pay a lot for the decore, but the food is no better or worse than a lot of other Chinese and Asian fusion places in NY.",price,negative
1070,"I am amazed by the poor reviews- I find this place to be standout Italian in an area flooded with Italian- great prices, great atmosphere, good service and a wonderful wine list.",service,positive
4779,Get the soup and a nosh (pastrami sandwich) for $8 and you're golden.,food,positive
1393,like saying her bread comes from a special bakery when we have seen her buying it dowtown manhathan.,food,negative
4505,There is a downside if you're ordering in -- the delivery guys have MAJOR attitude.,service,negative
1093,"The restuarant itself is not large, but seems to have several round tables to accomodate large groups hoping to save a buck to eat authentic Taiwanese.",ambience,conflict
3725,Bon appettite!!,miscellaneous,positive
1600,The staff ignored my friends and I the entire time we were there.,service,negative
863,"I plan to come here again and look forward to trying their assortment of bruschetta, panini's.....",anecdotes,positive
4244,We were exploring Grand Central and didn't want to eat in the food court.,miscellaneous,neutral
252,You are treated just like royality.,service,positive
2740,"We arrived for dinner expecting to be impressed by a place that has an impressive past - but, that's just it -- the PAST!",miscellaneous,negative
845,"by dinner time, they turn it around and mount a huge comeback!!",anecdotes,positive
4094,I loved this place!!,anecdotes,positive
4639,They need a kick out of it but until then the sushi is pretty good and the place is consistent.,ambience,positive
4192,This place has realy fresh sushi and a nice large menu of Japanese classic cuisine.,food,positive
3310,"Service is friendly, prices are good - delivery time was a little slow, but for the way this pizza tastes, I'm willing to overlook it.",price,positive
2247,Once for dinner and once for brunch.,anecdotes,neutral
559,I think that it is absolutely brilliant and well runned business operation.,anecdotes,positive
2280,LOVE the atmosphere - felt like I was in Paris.,ambience,positive
2658,I love to visit Murrays for my bagel fix.,miscellaneous,positive
2125,Chennai Garden is my favorite Indian restaurant in the city.,anecdotes,positive
1627,They are amazing!,miscellaneous,positive
2451,The grilled cheese at home afterwards was better.!!,food,negative
4086,"Our teenage kids love it, too.",anecdotes,positive
1488,The food's as good as ever.,food,positive
1878,"Good French restaurant in an area devoid of decent restaurants unless you're into eating 4 pound pastrami sandwiches at Katz' Deli, or Mexican food which is supplied by capable restaurants.",miscellaneous,positive
654,Rosario's is without a doubt one of the greatest pizzerias in existence.,anecdotes,positive
1723,But the thing that my wife and I hated was it was so loud and it felt like 'bar' or 'pub'.,ambience,negative
