,text,term,start,end,polarity
5,"Not only was the food outstanding, but the little 'perks' were great.",food,17,21,positive
12,Nevertheless the food itself is pretty good.,food,17,21,positive
21,"It took half an hour to get our check, which was perfect since we could sit, have drinks and talk!",check,32,37,neutral
25,The pizza is the best if you like thin crusted pizza.,pizza,4,9,positive
38,Faan's got a great concept but a little rough on the delivery.,delivery,53,61,negative
40,"From the incredible food, to the warm atmosphere, to the friendly service, this downtown neighborhood spot doesn't miss a beat.",atmosphere,38,48,positive
57,"Three courses - choices include excellent mussels, puff pastry goat cheese and salad with a delicious dressing, and a hanger steak au poivre that is out of this world.",courses,6,13,neutral
58,it's a perfect place to have a amanzing indian food.,indian food,40,51,positive
59,The place is so cool and the service is prompt and curtious.,service,29,36,positive
77,After really enjoying ourselves at the bar we sat down at a table and had dinner.,dinner,74,80,neutral
89,Go here for a romantic dinner but not for an all out wow dining experience.,dining,57,63,positive
94,The menu is very limited - i think we counted 4 or 5 entrees.,menu,4,8,negative
108,The pizza was pretty good and huge.,pizza,4,9,positive
121,"It may be a bit packed on weekends, but the vibe is good and it is the best French food you will find in the area.",French food,76,87,positive
124,Right off the L in Brooklyn this is a nice cozy place with good pizza.,place,48,53,positive
129,Our server checked on us maybe twice during the entire meal.,meal,55,59,neutral
137,"I have tried to make reservations, but both times, the hostess didn't have my name.",reservations,21,33,neutral
142,"An oasis of refinement:  Food, though somewhat uneven, often reaches the pinnacles of new American fine cuisine - chef's passion (and kitchen's precise execution) is most evident in the fish dishes and soups.",Food,25,29,conflict
145,"An oasis of refinement:  Food, though somewhat uneven, often reaches the pinnacles of new American fine cuisine - chef's passion (and kitchen's precise execution) is most evident in the fish dishes and soups.",soups,202,207,positive
160,Lahore is a great place to duck into late-night when you need some really tasty food on the cheap -- you'll likely have trouble finishing the amount of food you get for FOUR DOLLARS.,food,152,156,positive
166,The wine selection (by the glass and bottle) is wonderful and I always recommend that friends make a reservation if they're going to be in town.,wine selection,4,18,positive
171,"Order the panang duck, it's fantastic.",panang duck,10,21,positive
179,"Luckily we saved room for the BBQ Salmon, Sea Bass and Crispy Duck.",Sea Bass,42,50,positive
183,"Yes, they use fancy ingredients, but even fancy ingredients don't make for good pizza unless someone knows how to get the crust right.",pizza,80,85,negative
198,The food always tastes fresh and served promptly.,served,33,39,positive
225,"Our favorite meal is a pesto pizza, the house salad, and a good bottle of wine.",pesto pizza,23,34,positive
239,"I understand the area and folks you need not come here for the romantic, alluring ambiance or the five star service featuring a sommlier and a complicated maze of captain and back waiters - you come for the authentic foods, the tastes, the experiance.",service,108,115,positive
240,"I understand the area and folks you need not come here for the romantic, alluring ambiance or the five star service featuring a sommlier and a complicated maze of captain and back waiters - you come for the authentic foods, the tastes, the experiance.",foods,217,222,positive
242,"I understand the area and folks you need not come here for the romantic, alluring ambiance or the five star service featuring a sommlier and a complicated maze of captain and back waiters - you come for the authentic foods, the tastes, the experiance.",sommlier,128,136,positive
256,"The environment is romantic, but the food is horrible, the service is pathetic, and gabriella lies about everything she could.",food,37,41,negative
270,"A narrow corridor leads to a tiny space where there are three tiny white tiled counters, a great deal of mess (stacks of bottles, cans) and a small counter holding 12-14 entrees.",space,34,39,negative
272,"A narrow corridor leads to a tiny space where there are three tiny white tiled counters, a great deal of mess (stacks of bottles, cans) and a small counter holding 12-14 entrees.",counter,148,155,negative
284,would have rather tried terrace in the sky or water club for that price,price,66,71,negative
295,"The anti-pasta was excellent, especially the calamari, as were the filling pasta mains.",calamari,45,53,positive
303,"We are very particular about sushi and were both please with every choice which included: ceviche mix (special), crab dumplings, assorted sashimi, sushi and rolls, two types of sake, and the banana tempura.",ceviche mix (special),90,111,positive
331,You must have the crabmeat lasagna which is out of this world and the chocolate bread pudding for dessert.,dessert,98,105,positive
344,"Get your food to go, find a bench, and kick back with a plate of dumplings.",food,9,13,neutral
365,Lived in Shanghai most of my life and thought the food was comparable to the flagship Green Bo restaurant there.,food,50,54,positive
367,"I highly recommend Cafe St. Bart's for their food, the ambience and wonderful service.",ambience,55,63,positive
390,"The food was really good, I had the onion soup and it was one of the best ever.",onion soup,36,46,positive
393,"Based on the reviews for dinner, this is a place I would reconsider revisiting for that, but definitely not for Dim Sum again.",Dim Sum,112,119,negative
409,"If you want some roast duck, pork or chicken on rice with ginger, try them out!",chicken on rice with ginger,37,64,positive
421,"We have never had any problems with charging the meal or the tip, and the food was delivered quickly, but we live only a few minutes walk from them.",meal,49,53,positive
440,"The man that was hosting promised to save a table for our party of 7, then sat a party of 2 at the very table he was saving (mean while there were boths open all around).",table,104,109,negative
449,"Decor is nice and minimalist, food simple yet very well presented and cooked, and the wine list matches the food very well.",Decor,0,5,positive
457,We ordered a tuna melt - it came with out cheese which just made it a tuna sandwich.,cheese,42,48,neutral
460,"Especially liked chicken tikka and the naan, and the dals.",naan,39,43,positive
462,The waiters were not attentive except that the bill turned up on the table before we were finished.,waiters,4,11,negative
479,"The overall price tag was very very expensive, something I did expect.",price tag,12,21,negative
500,All we received was an apology as we left to see our show without dinner.,dinner,66,72,neutral
502,The table next to us asked if he crushed the grapes himself when their long overdue bottle of wine finally arrived.,grapes,45,51,neutral
505,Plain and simple it's bad thai food.,thai food,26,35,negative
507,"While certain staples are excellent (the burger, some of the pastas), the food is not really the point.",burger,41,47,positive
515,"The place is larger than most and features adequate seating unlike most joints, and has a bar which deserves a mention.",bar,90,93,positive
525,The lobster sandwich is $24 and although it was good it was not nearly enough to warrant that price.,price,94,99,negative
526,"May, the owner always has a smile on her and will warmly greet you.",owner,9,14,positive
527,The sides were ok and incredibly salty.,sides,4,9,negative
532,"The beverages were excellent, and the dessert was good.",beverages,4,13,positive
538,"Please if your thinking about it go, and stay the wait you won't be disappointed.",wait,50,54,negative
546,"Otherwise, this place has great service and prices and a nice friendly atmosphere.",atmosphere,71,81,positive
558,black white shakes came out good also.,black white shakes,0,18,positive
572,"I wouldn't even have complained at all if the food at least tasted good but the quality of food was crappy, too.",food,46,50,negative
576,The pizza is delicious and the proprietor is one of the nicest in NYC.,pizza,4,9,positive
582,The Waitstaff were very nice and suggested swordfish for my husband he enjoyed his meal.,Waitstaff,4,13,positive
593,"The Italian food has flavor (that can be sort of surprising on the UES), and the service turns from a nightmare to attentive,they sort of remind me of the NY Yankees of the late 90's, no matter how bad it look, you knew that there was a rally just around the corner...",service,81,88,conflict
595,"I found the food to be outstanding, particulary the salmon dish I had.",salmon dish,52,63,positive
615,i don't usually order wine with indian so i can't comment on their wine list or their wines.,wines,86,91,neutral
625,The waitress was very patient with us and the food is phenomenal!,food,46,50,positive
640,"otherwise, good stuff for late nite eats.",stuff,16,21,positive
644,"I plan to come here again and look forward to trying their assortment of bruschetta, panini's.....",bruschetta,73,83,positive
658,"delicious bagels, especially when right out of the oven.",bagels,10,16,positive
672,"We parked on the block of Nina's the place looked nice, with people obviously enjoying their pizzas.",place,37,42,positive
674,"The food is o.k., but not any better than what you get at a good neighborhood restaurant.",food,4,8,neutral
681,"Orsay, is without a doubt one of the best values for authentic French food in NYC.",French food,63,74,positive
715,Pair you food with the excellent beers on tap or their well priced wine list.,wine list,67,76,positive
731,"The place is a little tight and on a cold day, the seating by the entranceway can be pretty drafty.",seating,51,58,negative
754,"Probably much busier for lunch, it's seldom crowded for dinner (too close to downtown).",lunch,25,30,neutral
763,"Good spreads, great beverage selections and bagels really tasty.",bagels,44,50,positive
771,"Authentic food and they have REAL service, not just the rush you get sometimes when they try to push you out the door.",food,10,14,positive
773,Stick to the gulab jamun.,gulab jamun,13,24,positive
780,I was back-to-back with the diner at the table behind me and wait staff had to hoist trays over our heads as they squeezed past us again and again.,table,41,46,negative
781,With the theater 2 blocks away we had a delicious meal in a beautiful room.,meal,50,54,positive
797,"The food is delicious - from the specials to the regular menu-fare, the dishes are never a disappointment.",dishes,72,78,positive
817,I had Filet Mignon with garlic mash.,Filet Mignon with garlic mash,6,35,neutral
827,"- the bread at the beginning is super tasty and makes you want more - the pizza is delicious and comes in personal sizes, however be warned that the Peter's Favourite pizza with prosciutto and baby arugula is actually a margarite pizza with cold prosciutto and baby arugula on top, like a salad.",Peter's Favourite pizza with prosciutto and baby arugula,149,205,neutral
836,"While this isn't classical restaurant fare, the chef has given new life to an old cuisine with some really innovative and tasty dishes that are genuinely Indian without being heavy or same old restaurant burn-outs.",cuisine,82,89,neutral
838,The owner truly caters to all your needs.,owner,4,9,positive
851,Great romantic place for a date (try to get the corner booth table for a little privacy and to sit close!).,corner booth table,48,66,positive
863,Example is the soup which was about 6 oz for $12 dollars and the mushrooms where $12 for about 1oz.,mushrooms,65,74,positive
867,"From beginning appetizers, the scallops were incredible, to the delicious chocolate souffle with rasberry mint sorbet, we were delighted by the taste sensations.",scallops,31,39,positive
882,"While the ambiance and atmosphere were great, the food and service could have been a lot better.",atmosphere,23,33,positive
900,"My husband had the mesclun, salmon, and ice cream and he enjoyed all 3 courses.",salmon,28,34,positive
903,We were told that the wait was about twenty minutes and there would be no problem for our 8:00 pm curtain call.,wait,22,26,neutral
916,"It's not mind-blowing, but to me, thai food never is and never will be.",thai food,34,43,neutral
923,It is kinda nosiy and the tables are close together but it's still a beautiful place to enjoy a nice dinner.,place,79,84,positive
925,Nicky the Nose at the bar is a treat.,bar,22,25,neutral
930,"I haven't eat a lamb chop as delicious as that,the salads are really nice dressed with lemon and extra virgnin olive oil.",extra virgnin olive oil,97,120,positive
936,"The Pastrami sandwich was like buttah and with pickles and an icy cold beer to wash it down, it was a pleasurable experience.",beer,71,75,positive
951,Went there with my wife and we had to wait for a table even though you could see there many that were empty with not reservation sigh on them.,table,49,54,negative
963,"Growing up in NY, I have eaten my share of bagels.",bagels,43,49,neutral
967,"All the appetizers and salads were fabulous, the steak was mouth watering and the pasta was delicious!!!",appetizers,8,18,positive
973,"Besides having the table we had been promised given to other restaurant patrons twice before we were actually seated, we were served dishes we hadn't ordered three times, received one of our orders 20 minutes after the rest of the table had been served (and that order was undercooked), and charged $45 more than we should have been on our bill.",dishes,133,139,negative
985,And the Tom Kha soup was pathetic.,Tom Kha soup,8,20,negative
1014,they bring service up a notch by offerng complementary amuse bouche to all tables and gave us a small dessert for our celebration.,dessert,102,109,positive
1035,"However, in the summer of 2003, it seems the management has changed and the great big door has been replaced for a glass front ridding itself of the dark romantic getup.",door,86,90,positive
1043,"Barbecued codfish was gorgeously moist - as if poached - yet the fabulous texture was let down by curiously bland seasoning - a spice rub might have overwhelmed, however herb mix or other sauce would have done much to enhance.",sauce,188,193,negative
1051,"But don't ever order bacon late at nite (either platter or in sandwiches, for that matter don't from any take out place) as it is from the morning frying turns out hard almost like bacos, hurt my molars.",bacon,21,26,negative
1056,"Outstanding Bagels, but you get what you pay for.",Bagels,12,18,positive
1083,I really loved the different and inovated touch that's the cheff gives to the food.,cheff,59,64,positive
1089,"I had a terrific meal, and our server guided us toward a very nice wine in our price range, instead of allowing us to purchase a similarly priced wine that wasn't as good.",wine,146,150,negative
1091,"I had a terrific meal, and our server guided us toward a very nice wine in our price range, instead of allowing us to purchase a similarly priced wine that wasn't as good.",priced,139,145,neutral
1094,"The food is good, especially their more basic dishes, and the drinks are delicious.",dishes,46,52,positive
1102,"I had the tuna tartare with sake, mushroom ravioli with pinot noir, and the chocolate sampler with a dessert wine for $49.",dessert wine,101,113,positive
1104,The food is delicious and beautifully prepared along with the friendly and personable service.,food,4,8,positive
1126,"First the wrong bread came out with the appetizer, then when i tried to order a second glass of wine for my main course...",glass of wine,87,100,neutral
1168,There is also very limited seating and there can be a substantial wait in getting food at peak times.,food,82,86,neutral
1178,If you like spicy food get the chicken vindaloo.,spicy food,12,22,neutral
1189,Don't waste money on decor.,decor,21,26,neutral
1191,They also have a back garden open in the summer - cute and French with outdoor seating - what more could you ask for?,outdoor seating,71,86,positive
1195,I'd call it an 'italian dinner'.,dinner,24,30,neutral
1198,Have frequented 'ino for several years and the food remains excellent.,food,47,51,positive
1215,Try the spicy wontons and the salt pepper shrimps.,spicy wontons,8,21,positive
1226,"We laughed when he finally offered us a dessert menu and we left a 10 percent tip, which was generous, I feel.",tip,78,81,positive
1228,The staff ignored my friends and I the entire time we were there.,staff,4,9,negative
1231,"The in-house lady DJ on Saturday nights has outrageously good taste in music, and moreover, takes requests.",in-house lady DJ,4,20,positive
1233,"Great wine list, reasonably priced.--Sara",wine list,6,15,positive
1243,I recieved prompt service with a smile.,service,18,25,positive
1261,"not the food ,not the ambiance , not the service, I agree with the previous reviews you wait and wait , the wait staff are very rude and when you get in they are looking to get you right out .",ambiance,22,30,neutral
1263,"not the food ,not the ambiance , not the service, I agree with the previous reviews you wait and wait , the wait staff are very rude and when you get in they are looking to get you right out .",wait staff,108,118,negative
1264,I always get the Shabu-Shabu dinner and the beef is always fresh.,Shabu-Shabu dinner,17,35,neutral
1278,"On the other hand, if you are not fooled easily, you will find hundreds of restaurants that will give you service and ambiance that is on par with Alain Ducasse, and food that will outshine in presentaion, taste, choice, quality and quantity.",presentaion,193,204,negative
1294,"The owner is very friendly and a great guy, go try his pizza, you'll like it!",pizza,55,60,positive
1299,"With so many good restaurants on the UWS, I don't need overpriced food, absurdly arrogant wait-staff who don't recognize they work at a glorified diner, clumsy service, and management that doesn't care.",management,173,183,negative
1303,The service is a little scatty at times but all is forgiven when the food arrives.,food,69,73,positive
1306,"The bruscetta is a bit soggy, but the salads were fresh, included a nice mix of greens (not iceberg) all dishes are served piping hot from the kitchen.",dishes,105,111,positive
1308,"The bruscetta is a bit soggy, but the salads were fresh, included a nice mix of greens (not iceberg) all dishes are served piping hot from the kitchen.",iceberg,92,99,neutral
1344,Try the olive cream cheese or the lox spread on a whole wheat everything bagel.,olive cream cheese,8,26,positive
1347,"they didn't disappoint, service from the second i arrived at the door was extremely pleasant and attentive with almost one server per table.",service,24,31,positive
1352,The rice to fish ration was also good--they didn't try to overpack the rice.,rice,71,75,positive
1357,"The only positive was the wait staff, which was prompt, knowledgable, and likeable.",wait staff,26,36,positive
1365,My friend's food was also the complete opposite of what it's supposed to taste like (aND look like).,food,12,16,negative
1372,"We have been to this place many times, and always have great food, wine, and service.",service,77,84,positive
1375,The corned beef was tender and melted in my mouth.,corned beef,4,15,positive
1380,"Haru serves very fresh fish, has a trendy, modern ambiance, prime location on Park Avenue South and friendly service.",ambiance,50,58,positive
1381,"Haru serves very fresh fish, has a trendy, modern ambiance, prime location on Park Avenue South and friendly service.",location,66,74,positive
1385,"Very romantic fires - I've literally spent hours at Lanterna, drinking wine from their extensive wine and enjoying the ambience.",wine,97,101,positive
1388,"Always a nice crowd, but never loud.",crowd,14,19,positive
1395,"Great food, great prices, great service.",prices,18,24,positive
1399,Awsome Pizza especially the Margheritta slice.,Margheritta,28,39,positive
1410,"The crispy chicken wasn't for us, though.",crispy chicken,4,18,negative
1421,In reality (to maximize potential diners) they were still taking phone reservations and reallocating tables of those waiting in the lobby.,lobby,132,137,neutral
1434,Go to Volare for 1st class service and terrific food.,service,27,34,positive
1456,The drinks are always welll made and wine selection is fairly priced.,priced,62,68,positive
1457,We also had shared a house salad that was fresh.,house salad,21,32,positive
1459,And at the conclusion of this culinary nightmare the check was given to our table by knocking over a glass of water.,check,53,58,neutral
1465,"The space is a bit too small for live music, so on  jazz nights, it can be loud and cramped.",jazz nights,52,63,neutral
1479,Delicious food at a great price but do not go here on a cold day and sit by the front door.,food,10,14,positive
1480,Delicious food at a great price but do not go here on a cold day and sit by the front door.,price,26,31,positive
1481,Delicious food at a great price but do not go here on a cold day and sit by the front door.,front door,80,90,neutral
1488,Pizza was a little soggy.,Pizza,0,5,negative
1511,"NO more reservations, expensive tips and annoying stuff.",tips,32,36,positive
1521,"During our meal, the management came over and checked on us and even bought us a round of drinks.",round of drinks,81,96,neutral
1524,The menu choices are similar but the taste lacked more flavor than it looked.,taste,37,42,negative
1528,"The portions are HUGE, so it might be good to order three things to split (rather than one appetizer and entree per person) for two people.",portions,4,12,positive
1531,The appetizers are just OK and the main courses were decidedly subpar.,appetizers,4,14,neutral
1534,The exotic food is beautifully presented and is a delight in delicious combinations.,exotic food,4,15,positive
1544,Service was prompt and courteous.,Service,0,7,positive
1552,"Only wine and beer are served, but the house varities are actually quite good.",house varities,39,53,positive
1562,Decent wine selection too.,wine selection,7,21,positive
1565,"It saves walking in and waiting for a table in the often noisy, crowded bar at dinnertime.",table,38,43,negative
1574,great place to go for a drink too because they have 100 kinds of beer.,kinds of beer,56,69,positive
1578,"Meanwhile, the bartender continued to pour champagne from his reserve after we had finished our bottle and we enjoyed an amuse of turnip soup with pureed basil, gratis.",bartender,15,24,positive
1617,"The signs, the specials menus, food, and even all the waitstaff are ALL TOTALLY Japanese.",waitstaff,54,63,positive
1630,The staff is also attentive and friendly.,staff,4,9,positive
1637,All of the pizzas are terrific and the price is even better!,price,39,44,positive
1671,"The flavors are great, and the menu is extensive.",menu,31,35,positive
1677,The food has been consistant for years and it never lets you down.,food,4,8,positive
1688,"After complaining about the chicken dish, the manager came over to tell us that, no one had ever complained before, and that we just didn't know what the dish was supposed to taste like.",dish,154,158,neutral
1699,Went on a double date with friend and his girlfriend for a few drinks and appetizers.,drinks,63,69,neutral
1736,"The chicken pot pie is excpetiona, the cheeseburger huge and delictable, and the service professional wan warm.",cheeseburger,39,51,positive
1753,The quality of food at this restaurant accompanied  by fantastic live jazz makes this place a perfect 10!,live jazz,65,74,positive
1778,Very affordable and excellent ambient!,ambient,30,37,positive
1784,Why do people rave about the ambience.,ambience,29,37,negative
1785,Were meeting up with some friends for a drink at Lafayette 161 and happened to walk by Thai Angel famished.,drink,40,45,neutral
1793,They charge $6.00 for rice.,rice,22,26,negative
1802,"Although the tables may be closely situated, the candle-light, food-quality and service overcompensate.",food-quality,63,75,positive
1807,"From the spectacular caviar to the hospitable waitstaff, I felt like royalty and enjoyed every second of it.",caviar,21,27,positive
1812,This little place definitely exceeded my expectations and you sure get a lot of food for your money.,food,80,84,positive
1842,I really liked the noodle dishes at Rice Avenue compared to their Green Curry dish.,Green Curry dish,66,82,negative
1865,A cool place to hang with your friends for a couple of healthy drinks and desserts.,desserts,74,82,positive
1867,"I like Mamoun's food as well, but side by side, Kati Rolls just produce tastier food hands down.",food,16,20,positive
1871,"The service is a bit slow, but harkens back to my years growing up in Napoli, Italy where things are not rushed and when you sit down for dinner the table is yours all night.",table,149,154,positive
1872,But that wasn't the icing on the cake: a tiramisu that resembled nothing I have ever had.,icing on the cake,20,37,negative
1873,But that wasn't the icing on the cake: a tiramisu that resembled nothing I have ever had.,tiramisu,41,49,negative
1874,Great food and the prices are very reasonable.,food,6,10,positive
1876,Wine list is not huge but def well selected.,Wine list,0,9,conflict
1880,"Be sure to try the seasonal, and always delicious, specials.",specials,51,59,positive
1883,"Fresh, authentic, french cuisine in substantial portions.",french cuisine,18,32,positive
1884,"Fresh, authentic, french cuisine in substantial portions.",portions,48,56,positive
1897,"Service was decent, but not as smooth as I would expect from a place with these prices and reputation.",reputation,91,101,positive
