,text,category,polarity
3248,"Not someplace I would seek to try out but if I am in the area again, I will certainly stop by.",anecdotes,neutral
2422,"Service was decent, but not as smooth as I would expect from a place with these prices and reputation.",service,conflict
1717,"That place was awesome,,,  sally !",miscellaneous,positive
1388,I've been here a couple of times and have not been impressed.,miscellaneous,negative
4815,I guess the way my friends and I described it was The French Colonies.,anecdotes,neutral
2992,Nothing special about this place.,miscellaneous,neutral
3850,I was here a few weeks back and we had the worst customer service experience at a restaurant ever.,anecdotes,negative
494,We visit at least once a month.,anecdotes,neutral
4350,"They sell special sushi, everything have a topping, sauce and etc.",food,positive
2267,The quality of food at this restaurant accompanied  by fantastic live jazz makes this place a perfect 10!,ambience,positive
1119,"I went at 6:00 PM specifically for the pre-theater menu ($19.95 for roasted tomato soup with chevre, steak frites, creme brulee) and it was marvelous.",price,positive
1373,Did I mention the wine?,food,neutral
3589,"Our son loves pizza and we have a certified Neapolitan pizzaria in our home city (Seattle), we liked this nearly as much - and the differences were more about personal preference than any reflection on either restaurant.",anecdotes,positive
1430,"This restaurant is not worth the time, effort, or money to say the least.",miscellaneous,negative
4556,"The prices cannot be beat for the quality, quantity, freshness and taste.",food,positive
368,I had the Pad Thai and the noodles were sticky.,food,negative
580,So eat fast and order a lot.,anecdotes,neutral
4483,"The food was delicious, the atmosphere was relaxed, and we have now adopted Plate 347 as our Secret on Second!",ambience,positive
2912,Went last Thursday.,anecdotes,neutral
4150,Have been dozens of times and never failed to enjoy the experience.,miscellaneous,positive
1792,Warm and friendly in the winter and terrific outdoor seating in the warmer months.,ambience,positive
4481,Loved it!,miscellaneous,positive
701,You could get a much better dining experience for the same amount of money in a lot of other French Bistros.,miscellaneous,negative
2467,"Recommendations, of course, are required!",miscellaneous,neutral
2532,"Maybe I say so because it looked promising for people who like artery-clogging jewish deli food, but turns out to be poorly run and awful.",miscellaneous,conflict
232,The last time I went we were seated at a table in a corridor next to the kitchen.,miscellaneous,negative
2152,"The food was amazing, the service was so attentive and personable, and how about that ambience!",service,positive
2073,I noted it was crossed off on the bill.,anecdotes,neutral
2080,"An excellent alternative to fast food joints and ordering in but, the food was slightly disappointing.",food,negative
171,"This place, which is only a few months old, is perhaps Queens' biggest secret!",anecdotes,positive
73,"The quantity is also very good, you will come out satisfied.",food,positive
2167,"It's a place for people who pay a lot for mediocre food, noise and a chance to be with their fellow bridge and tunnel folks.",food,neutral
3208,"Delicate spices, onions, eggs and a kick-ass roti.",food,positive
4033,It was divine melts in your mouth.,food,positive
3079,"Off the beaten path, this jewel of a restaurant shines just one block away from the plethora of 6th street Indian restaurants.",miscellaneous,positive
1622,The place was quiet and delightful.,ambience,positive
636,this is can became on e of the NY Italian Food fare institutions.,anecdotes,neutral
817,"Great friendly service, Fast seating, Fast Delivery, Excellent sushi.",service,positive
4796,At first i was rolling my ideas of yet another French place on the UES.,anecdotes,neutral
1651,I always get the Shabu-Shabu dinner and the beef is always fresh.,food,positive
560,I think that it is absolutely brilliant and well runned business operation.,miscellaneous,positive
3088,Worth the trip from Manhattan.,miscellaneous,positive
4573,Horrible food and Horrible service.,service,negative
4336,I've dined at Alain Ducasse's restaurant in Monte Carlo for half the price for the same excellent dining experience.,price,positive
673,"For the people who want great food plus great service, Roxy is a place to AVOID!",service,negative
4799,In China the phrase for a good restaurant is hot and loud.,anecdotes,neutral
1037,The bagels are fabulous.,food,positive
4351,DO not try unless you're just going there to hang out like the rest of the hipsters who apparently have no sense of taste.,anecdotes,negative
1055,The place itself is beautiful the bar scene seems to be happening.,ambience,positive
3667,Great value for the quality ingredients.,food,positive
2132,My roommate and I LOVE this place.,anecdotes,positive
4057,I came here for my friend's birthday and keep coming back ever since.,anecdotes,positive
4545,"While most people can attest to spending over $50 on drinks in New York bars and hardly feeling a thing, the drinks here are plentiful and unique.",food,conflict
3363,So rude.,anecdotes,negative
595,Definitely a great spot for a nice occasion or date.,anecdotes,positive
1082,Also very inexpensive.,price,positive
53,Faan's got a great concept but a little rough on the delivery.,miscellaneous,positive
2558,"The decor is really blah, and not at all hip or happening.",ambience,negative
2662,The place was nice and calm.,ambience,positive
1353,It won't break the bank but I also wouldnt come back for the food.,price,conflict
2464,"It's the perfect restaurant for NY life style, it got cool design, awsome drinks and food and lot's of good looking people eating and hanging at the pink bar...",food,positive
283,"This place is really trendi but they have forgotten about the most important part of a  restaurant, the food.",anecdotes,positive
3196,Everyone that has ever come here with me has become a convert and returned regularly with their own friends.,anecdotes,positive
3770,"Bottom line: B+ for the food, F for the service.",service,negative
2490,"It's charmingly small and that leads to an atmoshere that is extremely cozy and romantic, even.",ambience,positive
1132,He takes real pride in his food and his business.,food,positive
0,But the staff was so horrible to us.,service,negative
3134,"The view is spectacular, and the food is great.",ambience,positive
3158,We could have made a meal of the yummy dumplings from the dumpling menu.,food,positive
2971,Came looking for this place because I heard good things.,anecdotes,neutral
3967,"Average to good Thai food, but terrible delivery.",service,negative
248,Wondering who had the best deals we noticed a line had formed to wait for this one particular establishment.,anecdotes,neutral
3122,"Even with the prix fixe pricing, this restaurant is not worth it.",miscellaneous,negative
4445,"If you're not familiar with the cuisine, you may encounter problems ordering here and be sure to bring plenty of cash with you as they don't accept credit cards.",miscellaneous,negative
2484,"My friends and I experienced amazing cheese and a delicious, new summer menu at Artisanal last night.",anecdotes,positive
3281,Do yourself a favor and walk the extra avenue from joe's to eat here.,miscellaneous,positive
1959,I'm sure I'll return for a final judgement tho.,anecdotes,neutral
4209,If you have a dumpling fetish i suggest you try some here!,food,positive
3155,I LOVED THE SHOWS.,ambience,positive
3142,Always great service!,service,positive
3268,Best Pastrami I ever had and great portion without being ridiculous.,food,positive
2756,The staff is courteous and friendly.,service,positive
3896,I definitely will go back.,anecdotes,positive
552,"The dim sum is ok but doesn't taste that fresh, and the little dishes don't look steamy hot as they should (also note lack of Chinese here).",food,negative
907,Much more reasonably priced too!,price,positive
1734,Try the olive cream cheese or the lox spread on a whole wheat everything bagel.,food,positive
924,HIGHLY RECOMMENDED!!!!!,miscellaneous,positive
338,"Granted the space is smaller than most, it is the best service you will find in even the largest of restaurants.",ambience,negative
4200,I would go back.,anecdotes,positive
2957,"The plain slice is great and if you get toppings, the whole slice is topped with them, not sparsely sprinkled on like some places.",food,positive
196,It's somewhere you can eat and be happy.,anecdotes,positive
4377,This place has got to be the best japanese restaurant in the new york area.,anecdotes,positive
675,"While the menu isn't especially groundbreaking, everything I've tried so far has been well-executed and tasty.",food,conflict
1219,We were told that the wait was about twenty minutes and there would be no problem for our 8:00 pm curtain call.,miscellaneous,neutral
713,Went there and had a combination of different seafood dishes and appetizers.,food,neutral
3001,"This place has good potential, but needs a significant amount of work before we can justify spending that much money on indian food you can get everywhere else.",price,negative
2950,"Cute place, nice wait staff but would never go there again.",service,positive
3877,Never in my life did I think that I could be satisfied both in taste and in quantity for $3.00 in NYC.,price,positive
986,"Go, go, hurry, before everyone finds out about it.",miscellaneous,positive
1569,"I had the cod with paella (spicy and very filling, I'm a big eater and could only eat half) while my boyfriend had the classic fish and chips (again, a big serving - at least 5 pieces of fish and a basketful of fries).",food,conflict
3950,"When my husband and go there, we spend $60.00 (have LOBSTER TAILS UMMMMM need I say more) I can't say any more, it a place you'll never forget If you never go, you'll miss A Meal of your life time",miscellaneous,positive
1928,"Decent Thai food in cute - though a bit dank - little Nolita hangout, BUT service terrible.",food,positive
2022,"BUt their best dish is thh Thai spiced curry noodles with shrimp - a dish that would cost $23.95 is most places, but it is $16 here.",food,positive
3351,I read the other review and have to say I had the opposite experience here last Sunday.,miscellaneous,neutral
2549,The prices were CHEAP compared to the quality of service and food.,service,positive
4438,They outshine HH.,miscellaneous,positive
1129,"While this isn't classical restaurant fare, the chef has given new life to an old cuisine with some really innovative and tasty dishes that are genuinely Indian without being heavy or same old restaurant burn-outs.",food,positive
432,I wish they had one near my office- I would go everyday.,miscellaneous,positive
148,We always have a delicious meal and always leave feeling satisfied.,food,positive
891,Ive passed by the spot tons of times always wanting to go in.,miscellaneous,neutral
1507,"I got the $10 10-piece dim sum combo, every bite of which was great.",food,positive
2697,The buffet had a nice selection.,food,positive
352,It could have been handled better.,anecdotes,negative
4013,"I love when restaurants think using fancy expensive ingrediants makes the food fine cuisine, even with no idea how to use them.",food,negative
3218,A little pricey but it really hits the spot on a Sunday morning!,price,negative
3409,We do not need to go to a four-star restaurant anymore.,anecdotes,neutral
2926,Waiters are slow but sweet.,service,conflict
1207,I had to share my table with a loud group of kids and the service was rude an unattentive.,service,negative
1110,I have tried literally every restaurant on curry row.,miscellaneous,neutral
1906,Delicious food at a great price but do not go here on a cold day and sit by the front door.,food,positive
221,Overall A oh ya even though there is waiting it is deff worth it,anecdotes,positive
853,The people that work there are always so friendly you forget you are in New York sometimes.,service,positive
1545,I have never before eaten 40 pieces of relatively good nigiri.,food,neutral
3790,"The food is good, but very expensive for the casualness of it.",price,negative
4747,They should have called it mascarpone with chocolate chips-good but a far cry from what the name implies.,food,conflict
730,"The waitress, seems to be more concerned of looking good than actually waitressing.",service,negative
1130,The owner truly caters to all your needs.,service,positive
1655,"Nha Trang, while being notorious for utter lack of comfort and decor, horribly slow wait staff and horribly quick meals, is one of the best vietnamese restaurants i've ever been to. the pho is delicious and comes with very fresh vegtables.",service,negative
2165,We just ate at Kai and were disapointed.,anecdotes,negative
2420,"And the staff is also young, energeic and hot!!!!",service,positive
1423,"Service was warm and attentive, beef carpaachio was exellent (huge portion) and pasta was fresh and well-prepared.",service,positive
3195,for out-of-towners who will get a big thrill out of the location!,miscellaneous,positive
2628,I've been eating at Taj Mahal for over twenty years and have found them to be the most excellent of the Indian eateries on this block of Indian restaurants.,anecdotes,positive
1437,They don't walk around with the trays of Dim Sum.,ambience,positive
3831,A defitely must visit.,miscellaneous,positive
641,Try the cheesecake!,food,positive
4274,"$6 and there is much tasty food, all of it fresh and continually refilled.",food,positive
3972,The entire place and the treatment we received felt as a conveyor belt.,ambience,negative
4265,"We figured we never had Argentinian Pizza before so we grabbed our lunch there, sharing a large Pelligrino, a pizza of two of their specials, one was goat cheese the other blue cheese, and both were excellent.",food,positive
1202,"Very excited to hear that short-term Chef Jason Narone has moved on, he truly was a low point of their Sterling track record.",miscellaneous,negative
947,It's definately not a place to go if you want to impress someone.,anecdotes,negative
1434,Keep up the good work guys!,miscellaneous,positive
187,I also ordered for delivery and the restaurant forgot half the order.,service,negative
3924,"For some reason the place was empty when we got in and remained so for the entire evening, I don't understand why but we had a blast and will definately go back the next time we are in the area.",anecdotes,positive
1275,The outdoor atmosphere of sitting on the sidewalk watching the world go by 50 feet away on 6th avenue on a cool evening was wonderful.,ambience,positive
4273,"It was raining, and we figured why not?",miscellaneous,neutral
2945,one of the best Chicken Tikka Masala.,food,positive
3191,"However, go for the ambience, and consider the food just a companion for a trip across the world!",food,negative
1751,The food is great and they have a good selecion of wines at reasonable prices.,price,positive
2417,The one vegetarian entree (Abby's treasure) was actually quite a surprise - it was delicious and had wintermelon covering an assortment of fresh mushrooms and vegetables.,food,positive
1362,It is a lot of fun with live entertainment and all kinds of Disney type special effects.,ambience,positive
2812,Bring your appetites.,anecdotes,neutral
2466,"Recommendations, of course, are required!",anecdotes,neutral
1960,I'm sure I'll return for a final judgement tho.,miscellaneous,neutral
4328,"It was the first place we ate on our first trip to New York, and it will be the last place we stop as we head out of town on our next trip to New York.",anecdotes,positive
284,"This place is really trendi but they have forgotten about the most important part of a  restaurant, the food.",miscellaneous,positive
717,The table next to us asked if he crushed the grapes himself when their long overdue bottle of wine finally arrived.,service,negative
495,We visit at least once a month.,miscellaneous,neutral
288,This should have been done in a back room - away from customers.,anecdotes,negative
2301,Very affordable and excellent ambient!,price,positive
4402,I keep my fingers crossed the whole subway ride hoping that there will be a table I can sit at by myself and not have to share with the rice congee soup people.,miscellaneous,neutral
2974,I live on the street this place is on.,miscellaneous,neutral
4597,"While this can hardly be called a restaurant, it is possibly the best deal in Manhatten: $4 for a plate heaped with rice and 2-3 entrees.",ambience,negative
310,The fish is fresh but the variety of fish is nothing out of ordinary.,food,conflict
311,Look I dont know if the people who wrote the reviews have ever been to a decent place (PLEASE TRY SOMEOTHER PLACES).,anecdotes,neutral
1515,"There was a long wait for a table outside, but it was a little too hot in the sun anyway so our insde table was very nice.",service,conflict
3798,I'm saving up for my next visit.,miscellaneous,positive
1215,The sauce on the pizza is sooo good with garlic and fresh tomatoes and they don't skimp.,food,positive
279,"Pizza and garlic knots are great as well, I order from them quite often and the delivery is always super quick!",service,positive
1075,With the theater 2 blocks away we had a delicious meal in a beautiful room.,food,positive
4507,Will give it another chance before I write it off.,miscellaneous,neutral
3686,This is a cute place and could be good but they need to get their act together.,miscellaneous,conflict
2634,"You rarely have to wait for a seat and the currys (masaman, green, red) are full of flavor and come super spicy if you ask for it.",food,positive
1942,"Inside is a little cramped, but to be expected.",ambience,conflict
1289,"Growing up in NY, I have eaten my share of bagels.",miscellaneous,neutral
1911,"Overall, I'm still impressed that the place even exists and the prices are quite decent but then again, its Chinatown.",anecdotes,neutral
215,I love Indian food and consider myself to be quite an expert on it.,food,positive
3659,The service is descent even when this small place is packed.,service,positive
67,this little place has a cute interior decor and affordable city prices.,price,positive
4043,We ran a little late for the reservation but it wasn't a problem to get our table immediately.,anecdotes,neutral
2320,"Fluke sashimi drizzled with jalapeno-lime olive oil, the fruit of the oil nicely highlighting the fish's sweetness.",food,positive
653,If you are in the area try The Bagel Shoppe on 74th street which is 3 blocks away on 2nd Ave.,miscellaneous,positive
2397,"I like Mamoun's food as well, but side by side, Kati Rolls just produce tastier food hands down.",food,conflict
1504,I am surprised to say the least and find such practice not worth the effort.,miscellaneous,negative
3507,You will be satisfied.,anecdotes,positive
910,"The food was not very tasty, the portioins were tiny even for such a high quality restaurant.",food,negative
3601,"As for the bar, this is another bad idea.",food,negative
2646,"Last memorial day, I tried to make reservations but was told they were closed that weekend (interesting, but...).",miscellaneous,negative
1249,"I haven't eat a lamb chop as delicious as that,the salads are really nice dressed with lemon and extra virgnin olive oil.",food,positive
1390,I've been many time and have never been disappointed.,miscellaneous,positive
1698,"Waiters tend to forget drinks completely, food portions are so tiny, two people have trouble sharing one entree.",food,negative
2610,No gimmicks here -- the food speaks for itself in its freshness and preparation.,food,positive
4028,"It only took about five or so minutes to get an empty table, but standing up wasn't too bad.",service,positive
603,"The food was terrific and the service classy, attentive, without being overbearing.",food,positive
1467,We had a great tiem watching the shows and characters and ar food was just what we were looking for.,food,positive
842,"($200 for 2 glasses of champagne, not too expensive bottle of wine and 2 after dinner drinks).",price,negative
2242,"But on a lazy Saturday night, we ended up going.",anecdotes,neutral
2428,Was there Friday night.,anecdotes,neutral
4738,Appetizers are somewhere around $7 each and the main dishes are between $11 and $16.,price,neutral
4080,Since my first dinner I have had the chance to have brunch at Orsay 3x.,anecdotes,neutral
4260,Ive been here so many times the waiters know my name.,anecdotes,neutral
261,I look forward to eating here again,anecdotes,positive
3445,"After the main course came, we didn't see our waiter for at least 40 MINUTES!",service,negative
3906,I've never been disappointed.,miscellaneous,positive
2929,We went to Ino for Valentines.,anecdotes,neutral
243,"Order the panang duck, it's fantastic.",food,positive
1648,"not the food ,not the ambiance , not the service, I agree with the previous reviews you wait and wait , the wait staff are very rude and when you get in they are looking to get you right out .",service,negative
3791,The only fallback on this restaurant is the prices.,price,negative
1696,"The production is a symphony, alot of fun to experience.The food sublime for the most part.",anecdotes,positive
2667,"Most of the servers are very attentive, friendly and quite attractive.",service,positive
4163,Plus they made a perfect martini.,food,positive
3136,"The place wasn't too hard to find, but it was kind of packed, as soon as my boyfriend and I got our food, the line reached the door.",miscellaneous,neutral
1870,"A very inviting restaurant, with friendly service.",service,positive
191,We have been to Montparnasse many times and return often for good reason.,anecdotes,positive
174,"It may be a bit packed on weekends, but the vibe is good and it is the best French food you will find in the area.",ambience,conflict
3130,"Where tanks in other Chinatown restaurants display a lurking myriad of sad-looking marine life in their murky waters, the tanks at Ping's are clear as glass with healthy-looking creatures who do not yet know that they will be part of some dim sum lover's brunch.",ambience,positive
1787,It has been my first choice ever since I discovered it .,miscellaneous,positive
3278,"Butter was melted, white wine warm, cheese oozing everywhere.",food,negative
273,The pizza here is delicious.,food,positive
487,"We were seated promptly as we had reservations, however after that the service was slow.",service,conflict
2483,"My friends and I experienced amazing cheese and a delicious, new summer menu at Artisanal last night.",food,positive
703,"The rest of the dim sum, though pricey by Chinatown standards, is worth it.",food,positive
622,One of the earlier people commenting on the restaurant did not get the that some experimenting is going on with the menu in a positive way.,miscellaneous,positive
4805,then we ordered a dinosaur rolls and white tuna sashimi.,food,neutral
1431,"Looking around, I saw a room full of New Yorkers enjoying a real meal in a real restaurant, not a clubhouse of the fabulous trying to be seen.",ambience,positive
4393,"Out of the hundreds of Italian restaurants in Queens, this is among the best.",anecdotes,positive
1783,We weren't even at our table for more than an hour total.,anecdotes,neutral
4808,How do you rate home?,anecdotes,positive
2576,The worst excuse for Japanese food I've ever encountered.,anecdotes,negative
1222,I'm told that it is open 24hrs which is good.,anecdotes,positive
3186,"Going to Ballato's is like coming home and eating in my own kitchen, an absolute delight!",anecdotes,positive
3361,For Park avenue I expected so much more.,miscellaneous,negative
2249,"I've been to at Cafe Spice probably 5-8 times, it is probably still the best Indian restaurant around Union Square.",anecdotes,positive
3509,Another great place to take out-of-towners!,anecdotes,positive
3340,My boyfriend and I were in NY for a few days and Pastis was a place that came recommended.,anecdotes,neutral
267,"A glass of Leaping Lizard, a glass of prosecco, and the mussels had everything happy.",food,positive
2067,"The signs, the specials menus, food, and even all the waitstaff are ALL TOTALLY Japanese.",ambience,positive
3814,I recommend to anyone who wants to dress up and impress the lady.,anecdotes,positive
4039,"- for dessert we split chocolate cake and vanilla gelato (with espresso), which were tasty, but I thought a bit overpriced.",price,negative
1897,Will never be back.,anecdotes,negative
4551,"The one up front will smile and say What can I get for you, brother?",service,neutral
3758,ALWAYS full with tourists (especially because of it's close proximity to Rockefeller Center).,ambience,neutral
3189,"try the spicy shrimp appetizer (again, not the greatest value in the world but worth the price) and the lamb vindaloo is great.",price,conflict
366,They were served warm and had a soft fluffy interior.,food,positive
1223,I'm told that it is open 24hrs which is good.,miscellaneous,positive
3521,I have been to Rao's probably 15 times the past 3 years and it keeps getting better.,anecdotes,positive
1306,Chance is a joke.,miscellaneous,negative
964,"We went here for lunch a couple of weeks ago on a Saturday, and I was thoroughly impressed with the food.",food,positive
1042,"The food was very good, a great deal, and the place its self was great.",ambience,positive
109,Not what I wanted to hear.,anecdotes,negative
4621,I went to Ruby Foos for my birthday and enjoyed our experience there.,miscellaneous,positive
900,Would recommend this place as a good date spot if you don't want to drop a ton of cash.,price,positive
1263,"If only they delivered, they'd make a mint!",anecdotes,positive
1585,What for?,anecdotes,neutral
4790,Visited there while on vacation and reading the reviews.,anecdotes,neutral
1682,The service is a little scatty at times but all is forgiven when the food arrives.,food,positive
