,text,category,polarity
1582,I have eaten at many pizza places around NYC and this is hands down the worst.,miscellaneous,negative
2966,"Everything is excellent, the menu is quite extensive, and you eat with a view on both sides of the city.",food,positive
750,I just read Mocaramel's review and felt compelled to respond.,miscellaneous,neutral
3828,"Anyhow, we were able to sit as long as we wanted and chat, which was nice.",ambience,positive
4285,Steamed fresh so brought hot hot hot to your table.,food,positive
2793,I would have gotten some cole slaw and a knish if my stomach had more space.,food,positive
3232,This restaurant was way overhyped.,anecdotes,negative
954,Wonderful at holiday time.,miscellaneous,positive
2403,I love this place!,miscellaneous,positive
2860,"The people with carts of food don't understand you because they don't speak English, their job is to give you the delicious food you point at.",food,positive
1566,all the food was excellent - considering the quality of food in most moderately priced restaurants is mediocre this was slightly more pricey and well worth it.,price,positive
2,"To be completely fair, the only redeeming factor was the food, which was above average, but couldn't make up for all the other deficiencies of Teodora.",anecdotes,negative
443,You will not be disapointed at all.,anecdotes,positive
890,Ive passed by the spot tons of times always wanting to go in.,anecdotes,neutral
658,"I had the salmon dish and while it was fine, for the price paid, I expected it to have some type of flavor.",food,conflict
1619,"The food's dazzling flavors overwhelm the palate, truly embracing the beauty of authentic Thai cuisine.",food,positive
49,"Best of all is the warm vibe, the owner is super friendly and service is fast.",service,positive
2617,The service is awful--the last time I was there (and I do mean the last time) we were told that they needed our table so we would have to leave.,service,negative
382,All conveniently delivered right to the door.,service,positive
2238,"While I quite liked the food and the ambience, I'm not quite sure if it they really deserve it the Michelin rating they have displayed so prooudly in the window.",food,conflict
579,we love th pink pony.,miscellaneous,positive
3930,"I've eaten at Pizza Gruppo a few times, but more often I order delivery.",anecdotes,neutral
4276,"Just straight up cheap, good food.",food,positive
1274,"Despite a slightly limited menu, everything prepared is done to perfection, ultra fresh and a work of food art.",food,conflict
3198,Food was good not great not worth the wait or another visit,food,conflict
2592,Its located in greenewich village.,anecdotes,neutral
168,"We ordered the special, grilled branzino, that was so infused with bone, it was difficult to eat.",food,negative
1422,"Service was warm and attentive, beef carpaachio was exellent (huge portion) and pasta was fresh and well-prepared.",food,positive
878,"wow! how have i missed this one ,tried Long Tan last week for the first time and now know what the NY TIMES and many more in the neighborhood already knew.",anecdotes,positive
3630,The meat dishes were only so-so.,food,neutral
1012,"When I'm feeling stressed by the noise and congestion around my office, I head for Cafe St. Bart's.",anecdotes,neutral
3402,I had a huge pastrami sandwich on a roll.,food,positive
4403,"Overall, the best bagel in town.",food,positive
3597,Suan is a great place that I often take my friends (classmates) too.,anecdotes,positive
4205,I'm not sure why these other reviewers are whining so much.,anecdotes,neutral
3112,My fiance took me to Scopa last week for my birthday and I couldn't believe the food.,miscellaneous,neutral
2731,I've read some of the previews reviews - people are either not New Yorkers or have more appreciation for ambience then food.,miscellaneous,neutral
376,"A narrow corridor leads to a tiny space where there are three tiny white tiled counters, a great deal of mess (stacks of bottles, cans) and a small counter holding 12-14 entrees.",ambience,negative
4437,They outshine HH.,anecdotes,positive
2774,we spent 50 $$ definetly will come back with my friends!!!,anecdotes,positive
4068,"Service here was great, food was fantastic.",service,positive
1956,"If you are a vegetarian, this really isn't a good place to go.",anecdotes,negative
2262,"being a fan of spicy ethnic foods, indian included, i made friends with this place long ago.",food,positive
2381,We had a most unpleasant experience at this restaurant.,miscellaneous,negative
739,"good music, great food, speedy service affordable prices.",service,positive
106,"Fabulous service, fantastic food, and a chilled out atmosphere and environment.",food,positive
2582,Okay-i don't mind the oily part (cause most are cooked that way) but it was way too bland.,food,negative
4302,"As a long-time patron of Mamoun's, I always figured that I had found the best late night food spot in the city.",miscellaneous,positive
569,This is as good as neighborhood restaurants come.,anecdotes,neutral
3003,"Everything is always cooked to perfection, the service is excellent, the decor cool and understated.",food,positive
3297,We began with the cheese fondue (the artisanal blend) and added apples and kielbasa to dip.,food,neutral
1304,you guys rock.,miscellaneous,positive
3960,If you are in search of the most authentic NYC deli experience look no further than the famous and historic Katz's Deli down on the Lower East Side.,miscellaneous,positive
2608,These innovators of french indian fusion do a great job of making dishes as interesting as possible while still being accessible.,food,positive
2720,this one is definintely my least favorite.,anecdotes,negative
3859,"Took my mom for Mother's Day, and the maitre d' was pretty rude.",anecdotes,negative
4472,"For years, I thought Tuscan cuisine was the best, but Salvatore converted me to the hearty Neapolitan fare on my first visit.",food,positive
2285,"Apparently, the good cook works then.",food,positive
919,I have been to Mary's many times and I like it.,miscellaneous,positive
1583,This place is a great stop for great food.,food,positive
2352,Tasty but expensive.,price,negative
4631,And everytime I go there's a bunch of drunk idiots making a scene out front.,ambience,negative
855,The location and ambience is Ok but the food is what makes up for it.,food,positive
3168,The food itself was just ok - nothing spectacular - but the service was awful.,service,negative
4259,This place has the best Chinese style BBQ ribs in the city.,food,positive
244,"Food is usually very good, though ocasionally I wondered about freshmess of raw vegatables in side orders.",food,conflict
285,I have NEVER been disappointed in the Red Eye.,anecdotes,positive
1826,There is a lot of variety even for people who eat vegetarian like me.,food,positive
3235,I've overheard comments from him to his employees that should not have been delivered in the dining area and I've been sitting there while he lectured another customer.,anecdotes,negative
985,"Go, go, hurry, before everyone finds out about it.",anecdotes,positive
2826,The food is nothing like its menu description.,food,negative
2215,"After hearing a lot of great things about the restaurant, and passing by it on a daily basis, we decided to try.",miscellaneous,neutral
2803,"The blond wood decor is very soothing, the premium sake is excellent and the service is great.",ambience,positive
4097,I care more about the food and ambience.,food,neutral
1152,Get there before 7pm.,anecdotes,neutral
92,"Ive been to many Thai restaurants in Manhattan before, and Toons is by far the best Thai food Ive had (except for my mom's of course).",food,positive
2149,Its also a bit of a hassle to get to without a car (I happen to live in Inwood).,miscellaneous,negative
4007,"This is, by far, my favorite restaurant in NYC and I only wish it were more affordable so I could go more often!",anecdotes,positive
2768,I would highly recommend this place to anyone who is looking for a fine Indian dining experience that is definitely a value for your dollar.,price,positive
1165,My first encounter happened one friday evening with a friend.,miscellaneous,neutral
3653,"You don't go to Mizu for excellent service, you go for the large amounts of food, the amiable atmosphere, and the hole-in-the-wall feeling of the place.",ambience,positive
2579,A million better places to go in the city.,miscellaneous,negative
2134,"The waitstaff are all very busy, it's not outstanding service, but I've never been dealt with rudely.",service,conflict
2786,"While the new restaurant still features much of the same classical furniture that made Tiffin so attractive, the menu has been overhauled.",anecdotes,neutral
3875,"I recommend their Pad See Ew, Pork Chops or Tofu plates.",food,positive
2934,The music is the best among all the Indian restaurants I have visited.,ambience,positive
1174,Consistently good Japanese Tapas.,food,positive
3806,Yeah Shanghai is also great but not quite as good -- they use the same amount of salt but without sweetness to balance out.,anecdotes,neutral
2071,"I'm no food critic, but I'd like to think I have a tiny bit of experience under my belt having lived in NY for the last 11 years.",anecdotes,neutral
3670,"The Thali was small, thoroughly unremarkable, and $14.95.",price,negative
1234,"Food was very good as well, considering that we tried the budget selection (though I wish the pork belly that I ordered was roasted a bit longer, so that fat was more of a melt-in-your-mouth experience).",food,conflict
380,Decent wine at reasonable prices.,food,positive
1391,Ciao Bella,anecdotes,neutral
144,"Unfortunately, the food is outstanding, but everything else about this restaurant is the pits.",anecdotes,negative
2862,"Not the greatest sushi place, but excellent for a $19.95 all you can eat.",food,neutral
164,All my co-workers were amazed at how small the dish was.,food,negative
3176,Give it a try and enjoy.,miscellaneous,positive
1705,Just go and see for yourself.,anecdotes,neutral
3260,I recently tried Suan and I thought that it was great.,miscellaneous,positive
2807,"Be careful, when they say spicy, they mean it!",miscellaneous,neutral
908,"If you venture off the island of Manhattan and can't seem to find a great Italian restaurant, drive to Corona.",anecdotes,neutral
862,"I plan to come here again and look forward to trying their assortment of bruschetta, panini's.....",food,positive
3182,The only thing I could get attention from was one of at least two cats running around that kept batting at my table.,anecdotes,negative
3721,"The service was attentive, yet unimposing, the food was far better than many notorious restaurants in Midtown and the wine list is extensive and well priced.",service,positive
599,Very popular style Izakaya (Sake and small portion of sake-friendly dishes ).,food,positive
3150,I went to DF for Valentines Day dinner.,anecdotes,neutral
2936,"He always says, I don't have customers.",anecdotes,neutral
1047,A great choice at any cost and a great deal.,price,positive
3529,"The service is friendly, if not the most prompt in the world, the food is great, and the prices, while not cheap, won't put your wallet out of commission.",service,positive
512,And it was quick which is very important.,service,positive
1533,This is my first time writing a review for a restaurant because the food and service was excellent.,miscellaneous,positive
2668,I think locals rate this place so high.,anecdotes,neutral
4240,"During the course of the past 3 months, the chef and staff changed and it was not for the better.",food,negative
199,"If you wrote a bad review, it's because you don't understand what Rao's is all about.",miscellaneous,positive
621,One of the earlier people commenting on the restaurant did not get the that some experimenting is going on with the menu in a positive way.,anecdotes,positive
405,I've eaten at many different Indian restaurants.,anecdotes,neutral
2179,It was wonderful.,anecdotes,positive
1940,I brought some buddies from CA and they loved it.,anecdotes,positive
3153,I LOVED THE SHOWS.,anecdotes,positive
968,"To give you an idea of how good we thought it was, we ended up going to Ping's three weekends in a row!!!",anecdotes,positive
4213,The waiters and owners were nonchalant about this and promised to call the exterminator but weren't as dismayed or apologetic as I would have expected.,service,negative
3476,Had a late night dinner on a Saturday night.,miscellaneous,neutral
2777,Went to Village last night for my birthday.,anecdotes,neutral
2792,We visited Orsay during NY Restaurant Week and tried their $35 menu.,miscellaneous,neutral
769,"For all you lazy folks that don't want to come to Alphabet City, I say, good - stay out.",anecdotes,neutral
453,I recently went to this restaurant with some co-workers for lunch and had an amazing time.,anecdotes,positive
3496,It's to die for!,anecdotes,positive
2009,"If you want a casual neighborhood bistro that has great food and excellent service, this is the place.",service,positive
4195,"My wife and I also enjoyed the spinach, the Shanghai low mein, and other attractions.",food,positive
2210,I for one will never patronize them again.,anecdotes,negative
1433,Keep up the good work guys!,anecdotes,positive
515,All the NYU students love this place so it makes for a fun young atmosphere.,ambience,positive
51,This isn't a value joint.,price,negative
2619,We could only get through an appetizer and cheese fondue.,anecdotes,neutral
2637,I highly recommend to anyone to give this place a try.,anecdotes,positive
2201,"They brought glasses and the bottle, and just left the bottle at our table.",service,negative
4788,The restaraurant is very small so reservations are a must.,anecdotes,neutral
1364,"No refills on fountain drinks, though.",food,negative
4101,Avoid at all costs.,anecdotes,negative
2039,Stuffing yourself with Japanese food is a rare thing.,food,neutral
2015,"Meanwhile, the bartender continued to pour champagne from his reserve after we had finished our bottle and we enjoyed an amuse of turnip soup with pureed basil, gratis.",food,positive
3160,"Then, get ripped on free box wine.",food,positive
2601,"Overall the restaurant is more expensive than our other sushi favorites, but everything was delicious.",food,positive
4574,The wine and cheese plate are plentiful and can't wait to try the fondue or table grilling.,food,positive
4711,for my birthday and we had an excellent time.,miscellaneous,positive
1573,This is the first time Citysearch did't call it right.,miscellaneous,neutral
324,"I understand the area and folks you need not come here for the romantic, alluring ambiance or the five star service featuring a sommlier and a complicated maze of captain and back waiters - you come for the authentic foods, the tastes, the experiance.",ambience,positive
2717,Our first time in New York and we had to try a New York Bagel.,anecdotes,neutral
22,The pizza is the best if you like thin crusted pizza.,food,positive
4127,None of that yucky whipped stuff.,food,positive
1882,The drinks are always welll made and wine selection is fairly priced.,price,positive
1712,I hate this.,anecdotes,negative
1779,The corned beef was tender and melted in my mouth.,food,positive
2438,I have taken practically every guest that has come to visit me in NY and hooked a few New Yorkers onto Peep as well.,miscellaneous,positive
4355,"The place is small and intimate and you may feel a little crowded, but the service is excellent and it's great for friends out, a romantic date, or a special occassion.",service,positive
748,I've lived in NY for 5 years and this place has it all.,miscellaneous,positive
1555,"While the place is not a hotspot hangout, the drinks are unique and pack a lot of bang for the buck.",price,positive
3175,Give it a try and enjoy.,anecdotes,positive
1784,We weren't even at our table for more than an hour total.,miscellaneous,neutral
239,The wine selection (by the glass and bottle) is wonderful and I always recommend that friends make a reservation if they're going to be in town.,food,positive
340,"Have recommended the place to friends, always gets good response.",miscellaneous,positive
829,"Emilio, the owner, is often sitting in the front table greeting guests as they come and go.",service,positive
4532,"The ambience was so fun, and the prices were great, on top of the fact that the food was really tasty.",ambience,positive
3187,"Going to Ballato's is like coming home and eating in my own kitchen, an absolute delight!",miscellaneous,positive
1534,Definitely Highly NOT recommended.,anecdotes,negative
3697,We actually left hungry and went across the street to Wo Hop at 15 Mott street for some good chinese food.,food,positive
3588,But $1 for each small piece???,price,negative
4155,"Staffs are not that friendly, but the taste covers all.",food,positive
836,"A cheap eat for NYC, but not for dosa.",price,conflict
4016,THe Pizza and wine were excellent-the service too--but what really MADE this place was the backyard dining area.,ambience,positive
2233,This food is asian-air fusion.,food,neutral
3590,"Our son loves pizza and we have a certified Neapolitan pizzaria in our home city (Seattle), we liked this nearly as much - and the differences were more about personal preference than any reflection on either restaurant.",miscellaneous,positive
500,I felt as though I were eating in Paris.,ambience,positive
3629,I just do not understand what the fuss is all about.,miscellaneous,negative
3275,"Again, if you are in this neighborhood - by all means, come here.",anecdotes,positive
1242,I love the fact that the pizza tastes so good and is so cheap.,price,positive
3822,"Been there, done that, and New York, it's not that big a deal.",miscellaneous,neutral
3916,"I wouldn't mind going back some time, but not before trying others nearby.",anecdotes,conflict
4201,I would go back.,miscellaneous,positive
4250,Everything that happened was not even up to mediocre.,miscellaneous,negative
3553,Go for it!,anecdotes,positive
605,This is an amazing place to try some roti rolls.,food,positive
2240,i'm surprised about some of the bad reviews posted here - i've been to tamarind about 5 or 6 times and always come away extremely satisfied and looking forward to returning.,anecdotes,positive
4154,Of course the reason its so packed is because the food is so delicious!,food,positive
3135,"The place wasn't too hard to find, but it was kind of packed, as soon as my boyfriend and I got our food, the line reached the door.",anecdotes,neutral
1295,"Besides having the table we had been promised given to other restaurant patrons twice before we were actually seated, we were served dishes we hadn't ordered three times, received one of our orders 20 minutes after the rest of the table had been served (and that order was undercooked), and charged $45 more than we should have been on our bill.",service,negative
3651,"You don't go to Mizu for excellent service, you go for the large amounts of food, the amiable atmosphere, and the hole-in-the-wall feeling of the place.",food,positive
2802,"The blond wood decor is very soothing, the premium sake is excellent and the service is great.",service,positive
3374,"Very neighborhoody, very quick and sufficient.",ambience,positive
212,This restaurant used to be pretty decent.,miscellaneous,negative
3317,A word to the wise - the Hoboken health inspector clued me to his findings that this is THE cleanest restaurant in town.,anecdotes,positive
1817,"Try ordering from the regular menu, then you would not regret!",food,positive
3867,"If you are looking for a good quality, cheap eats - this is the place.",food,positive
4027,"We all had the tasting menu and unlike some of the other reviews, I felt there was more than enough food.",food,positive
2647,"Last memorial day, I tried to make reservations but was told they were closed that weekend (interesting, but...).",service,negative
2295,"Spice is sleek, modern and cool with a menu that will not hurt your wallet.",price,positive
4596,The food was great and the service was even better.,service,positive
3341,My boyfriend and I were in NY for a few days and Pastis was a place that came recommended.,miscellaneous,neutral
1258,"After all that, they complained to me about the small tip.",service,negative
4319,I have been to Casimir over 5 times and I have always had a great time there.,miscellaneous,positive
1180,They also do a great job for restaurant week.,anecdotes,positive
302,"First off, the waitress was completely unattentive the 2 times we saw her(odd in a restaurant with 6 tables) and got our order wrong.",service,negative
4587,"The food came out wrong, the waiter was no where to be found and the wine showed up at the end of the meal.",service,negative
1739,So my husband made up an excuse so we can leave.,anecdotes,negative
75,I have been to Roth's twice and both times were very disappointing.,miscellaneous,negative
4439,Although we were looking for regular lettuce and some walnuts the salads we got were great.,food,positive
3247,I thought I had died and gone to heaven.,miscellaneous,positive
799,"my personal favorite is an everything bagel with lox spread, but all the bagles are unbeliavably good.",food,positive
3797,I'm saving up for my next visit.,anecdotes,positive
1490,"The crust is thin, the ingredients are fresh and the staff is friendly.",service,positive
1726,"While there are plenty of places to go for a good corned beef sandwich, Katz's has a charm about it.",food,positive
2355,"Both are delicious, the cooks are friendly and are willing to take a moment and speak to you and shake your hand.",service,positive
1028,This is my favorite Italian restaurant in all of New York City.,miscellaneous,positive
4058,I came here for my friend's birthday and keep coming back ever since.,miscellaneous,positive
1615,Beef noodle soup is good as well.,food,positive
4446,"both are very reasonably priced (around $8 for dinner and $5 for lunch), and are delicious and filling.",food,positive
1899,"The entree was bland and small, dessert was not inspired.",food,negative
162,They are often crowded on the weekends but they are efficient and accurate with their service.,service,positive
52,Faan's got a great concept but a little rough on the delivery.,anecdotes,positive
2741,"However, I think this place is a good hang out spot.",ambience,positive
3086,"Again, the waitress was awesome.",service,positive
3808,Yeah Shanghai is also great but not quite as good -- they use the same amount of salt but without sweetness to balance out.,food,neutral
2817,For dinner I had the chicken tikka-masala and some garlic naan.,food,neutral
2023,"BUt their best dish is thh Thai spiced curry noodles with shrimp - a dish that would cost $23.95 is most places, but it is $16 here.",price,positive
2773,I consider the best Grand Sichuan restaurant in NYC.,miscellaneous,positive
4216,And the food was fantastic.,food,positive
4603,"Consequently, their burgers fell apart in their hands and made such a mess that they did'nt feel like finishing them.",miscellaneous,negative
1320,Tends to turn people away.,miscellaneous,negative
3728,The owners and employees are friendly and their pizza is fantastic.,service,positive
4048,We arrived on time for our reservation and seated promptly.The,anecdotes,neutral
2852,Warning: You may find it difficult to dine at other Japanese restaurants after a visit to Mizu!,anecdotes,positive
1168,There are other people waiting!,service,neutral
4290,"The staff makes you feel at home, the food is great and the atmosphere is WONDERFUL!",service,positive
4748,"A gentleman, maybe the manager, came to our table, and without so much as a smile or greeting asked for our order.",service,negative
2259,She gets 10 for her excellent service and advice.,service,positive
94,I highly recommend the Sophia pizza.,anecdotes,positive
2485,"My friends and I experienced amazing cheese and a delicious, new summer menu at Artisanal last night.",miscellaneous,positive
2842,I will be returning.,miscellaneous,positive
3474,"The mussaman curry that I ordered was as thin as water and aside from the poorly fried tofu that I ordered in it, they graciously provided me with ONE piece of poorly cooked potato.",food,negative
4009,"This is, by far, my favorite restaurant in NYC and I only wish it were more affordable so I could go more often!",price,negative
2168,"It's a place for people who pay a lot for mediocre food, noise and a chance to be with their fellow bridge and tunnel folks.",ambience,negative
1564,"Each bite of food at Kai was indeed delicious, fresh, and elegant.",food,positive
2380,We had a most unpleasant experience at this restaurant.,anecdotes,negative
774,Highly recommend this as great value for excellent sushi and service.,food,positive
3132,"The Halibut was too salty, dessert was so so (don't waste any of your calories) and service was poor.",service,negative
4348,THe perfect spot.,miscellaneous,positive
3512,"But, hey, there is anything better with a decent vegetarian selection in Astoria.",miscellaneous,neutral
3938,Decor leaves something to be desired.,ambience,negative
3998,"Take a good sense of humor,an American express card with no limit, walk out with a lollipop,gift bag in hand and enough marketing materials for alain to to take the show on the road",price,negative
3872,A friend from Seattle and I went on a Thursday night around 8:30.,anecdotes,neutral
1594,"But people from Sichuan will die for it)  - Chongqing Hot Pot, chongqing was the biggest city of Sichuan, now became an independent province.",anecdotes,positive
2557,"This was the perfect quiet, relaxing, and delicious accompaniment to our afternoon of theater.",ambience,positive
24,My Girlfriend and I stumbled onto this hopping place the other night and had a great time!,miscellaneous,positive
2361,"The staff was accomodating, the food was absolutely delicious and the place is lovely.",service,positive
