,text,category,polarity
912,My friend from Milan and myself were pleasantly surprised when we arrived and everyone spoke italian.,miscellaneous,positive
392,The only thing more wonderful than the food (which is exceptional) is the service.,food,positive
3197,Everyone that has ever come here with me has become a convert and returned regularly with their own friends.,miscellaneous,positive
2732,"Toons has recently been redone, so it's now a very attractive space.",ambience,positive
2404,it is not consistent.,anecdotes,negative
3918,"Nice ambiance, nice little bar, good bartender, Francois, and good service.",service,positive
4781,I have to say that if this what makes it easier to get a saet a lunch- I dont mind.,anecdotes,neutral
3514,We were less than impressed.,miscellaneous,negative
2703,I've been several times and am totally smitten.,miscellaneous,positive
3044,Arigato Gozimas Yuka!,miscellaneous,neutral
4690,One of my favorite restaurants in the neighborhood.,miscellaneous,positive
1009,"Anyway, this is the last time I cross the williamsburg.",miscellaneous,negative
2338,I will be going back and heartily recommend it!,miscellaneous,positive
34,IT IS DEFINITELY SPECIAL AND AFFORDABLE.,miscellaneous,positive
3034,If you've ever been along the river in Weehawken you have an idea of the top of view the chart house has to offer.,ambience,positive
3957,The neighborhood was nice though so check out another restaurant instead.,miscellaneous,negative
3249,"Not someplace I would seek to try out but if I am in the area again, I will certainly stop by.",miscellaneous,neutral
3224,As soon as I wake up on a saturday or sunday it is the first thing on my mind is when and how I will be getting to fried dumpling.,anecdotes,positive
4087,"Our teenage kids love it, too.",miscellaneous,positive
2733,"$160 for 2 filets, 2 sides, an appetizer and drinks.",food,neutral
4221,"Aside from the Sea Urchin, the chef recommended an assortment of fish including Fatty Yellow Tail, Boton Shrimp, Blue Fin Torro (Fatty Tuna), Sea Eel, etc.",food,neutral
3739,It is simply amazing.,anecdotes,positive
1414,"Outstanding Bagels, but you get what you pay for.",price,negative
298,"service is friendly, and never had a problem walking in and getting a table.",service,positive
963,I ordered the smoked salmon and roe appetizer and it was off flavor.,food,negative
4314,"The staff has been nice, but they seemed really stressed and the unisex bathroom needs to be cleaned more often.",service,conflict
2012,But this place is a well-oiled machine so they know what they're doing.,miscellaneous,positive
768,"When going out for a nice dinner, I like a nice ambiance as well as very good food.",miscellaneous,neutral
4194,The sushi is average and the prices are anything but.,price,negative
4764,"I wasn't there for the Half-Price Saturday Night Special, but Tuesday Night.",miscellaneous,neutral
3654,"The service is always bad though, don't expect much of anything from your server, and I would not recommend bringing a date here either.",service,negative
4449,Problem is nothing at Prune is particularly memorable.,miscellaneous,negative
2506,"The staff is accomodating, the ambiance is exciting and yet relaxed, and the food is out of this world!",service,positive
1643,"If you go to Roth's try to be served by Mike, he is GREAT!!",service,positive
3988,"I am Indian, and I have tried many Indian places in NY.",miscellaneous,neutral
4063,"We concluded with tiramisu chocolate cake, both were delicious.",food,positive
2443,My chow fun and chow see was really bland and oily.,food,negative
2442,I don't live in NY but my best friend does.,miscellaneous,neutral
446,Walk-ins are risky too.,miscellaneous,negative
134,"Great bagels, spreads and a good place to hang out in.",food,positive
3194,for out-of-towners who will get a big thrill out of the location!,anecdotes,positive
731,"The place is larger than most and features adequate seating unlike most joints, and has a bar which deserves a mention.",ambience,positive
796,Great bagels made the old-fashioned way.,food,positive
1024,Don't leave without trying One Night in Tokyo.,miscellaneous,positive
4582,THE BIG COMPLAINT: NO TOASTING AVAILABLE.,food,negative
800,"I wouldn't even have complained at all if the food at least tasted good but the quality of food was crappy, too.",food,negative
2183,I just don't understand all the hype...,anecdotes,negative
4237,"If it isn't for the food (A+++), it must be the service or the ambience.",service,positive
3027,Great food at reasonable prices.,price,positive
1361,However it is the ONLY Taiwanese restaurant in town.,miscellaneous,neutral
265,Tuk Tuk is one of those comfortable neighborhood joints where you know you will always have a good meal at a fair price.,ambience,positive
930,"We parked on the block of Nina's the place looked nice, with people obviously enjoying their pizzas.",miscellaneous,positive
3666,This place is worth an one-hour drive.,miscellaneous,positive
3907,I won't go back unless someone else is footing the bill.,price,negative
3010,"Great selection of wine, and seafood.",food,positive
3586,"I like Cafe Noir dont get me wrong, it is jsut that the people who work there are evil and incompetent!!",service,negative
2469,You fellas above says its the best Taiwanese restaurant in town.,anecdotes,neutral
3518,but still my date was bad,miscellaneous,negative
41,"All the money went into the interior decoration, none of it went to the chefs.",food,negative
214,"If you love wine and cheese and delicious french fare, you'll love Artisanal!",food,positive
477,"With so many poor experiences to be had in the theater district, is truly an excellent find!",anecdotes,positive
4707,"Please take my advice, go and try this place.",anecdotes,positive
2474,"Good, fast service.",service,positive
3853,(I've ordered from the 2nd ave.,anecdotes,neutral
3895,"In any event, even though its a bit on the pricey side, we still love this restaurant and will definitely go back.",price,negative
4426,"The service was excellent, the food was excellent, but the entire experience was very cool.",food,positive
1413,"Outstanding Bagels, but you get what you pay for.",food,positive
1005,If you like your music blasted and the system isnt that great and if you want to pay at least 100 dollar bottle minimun then you'll love it here.,ambience,negative
856,The location and ambience is Ok but the food is what makes up for it.,ambience,neutral
3517,but still my date was bad,anecdotes,negative
819,"The Italian food has flavor (that can be sort of surprising on the UES), and the service turns from a nightmare to attentive,they sort of remind me of the NY Yankees of the late 90's, no matter how bad it look, you knew that there was a rally just around the corner...",food,positive
650,Go here.,anecdotes,positive
268,"Food was average and creme brulee was awful - the sugar was charred, not caramelized and smelled of kerosene.",food,negative
3809,"believe us, we've been eating sushi for over 15 yrs.",anecdotes,neutral
1178,"This place started off a little iffy, but is now one of my favorite indian restaurants in NYC (and I'm indian, so I should know).",anecdotes,conflict
4548,"The food arrived 20 minutes after I called, cold and soggy.",food,negative
2723,I have been urged by friends for months to check out the mermaid inn.,miscellaneous,neutral
295,"The pizza is delicious - they use fresh mozzarella instead of the cheap, frozen, shredded cheese common to most pizzaria's.",food,positive
2384,Great staff.,service,positive
1426,I will recommend Scopa to all of my friends for a place to go for wonderful Italian food.,food,positive
3803,This place has the the correct ambience and an excellent staff to make you feel like a guest and a friend at the same time.,ambience,positive
50,"Best of all is the warm vibe, the owner is super friendly and service is fast.",ambience,positive
4612,We will be back.,anecdotes,positive
2136,I have lived in Japan for 7 years and the taste of the food and the feel of the restaurant is like being back in Japan.,ambience,positive
3154,I LOVED THE SHOWS.,miscellaneous,positive
1575,"The porcini mushroom pasta special was tasteless, so was the seafood tagliatelle.",food,negative
2754,"Okay, so I never write but there doesn't seem to fair balance of positive to negative reviews concerning Green Bo and it's time to speak up - I live in Chinatown.",miscellaneous,neutral
4279,Another welcome addition to the neighborhood.,miscellaneous,positive
3561,Won't or Can't is not in the service directory.,service,positive
3545,I had a great experience.,miscellaneous,positive
1838,this place is amazingly bad.,anecdotes,negative
1556,I have walked by this place for eons and finally went thanks to a girls' night.,anecdotes,neutral
2895,I would highly recommend it.,miscellaneous,positive
306,But they do.,anecdotes,neutral
4774,Want to impress?,anecdotes,neutral
3596,By far the best salad I have had in a fast food restaurant.,food,positive
1264,"If only they delivered, they'd make a mint!",miscellaneous,positive
499,I'll keep this short.,miscellaneous,neutral
132,The menu is limited but almost all of the dishes are excellent.,food,conflict
276,On a monthly basis my friends and I get together and have a girls night out.,anecdotes,neutral
3598,Suan is a great place that I often take my friends (classmates) too.,miscellaneous,positive
1905,"The Pad thai, lad nar and various other dishes all look good on paper but, I've had better thai food in less asthetically pleasing places.",food,conflict
3940,Jimmy is Dominican!,miscellaneous,neutral
3204,I think the restaurant was too loud (when full) to be romantic.,ambience,negative
2755,The zucchini and mashed potatoes are a blend of garlic and butter which simply melts in your mouth.,food,positive
3223,The menu has lots of options: I hope to go back to try those potato pancakes.,food,positive
779,"This is my fourth try over a two year period, and I'm done.",anecdotes,negative
3348,"For authentic Thai food, look no further than Toons.",food,positive
4167,The waiter was attentive.,service,positive
3426,"Then, IF they answer the phone, you're lucky if they don't hang up on you!",service,negative
1233,"It's not mind-blowing, but to me, thai food never is and never will be.",food,neutral
479,This has got to be one of the most overrated restaurants in Brooklyn.,anecdotes,negative
1108,Both the fresh mozzerella slices and the Plain Cheese slice are phenomenal.,food,positive
2699,This restaurant is such a great place.,anecdotes,positive
1134,Every time in New York I make it a point to visit Restaurant Saul on Smith Street.,miscellaneous,positive
2327,"On a recent Sunday afternoon, a friend and I accidently found this great restaurant on our way to see the pulitzer prize winning play DOUBT.",miscellaneous,positive
3774,"Stick to dimsum, not super overpriced noodles.",food,negative
3644,I can't wait to go back.,miscellaneous,positive
839,"The seafood is amazing, there's a good wine list, and the ever-changing menu always offers some great surprises.",food,positive
652,If you are in the area try The Bagel Shoppe on 74th street which is 3 blocks away on 2nd Ave.,anecdotes,positive
3564,I do suggest to ask to be seated upstairs if you are looking to be a little cozy.,miscellaneous,neutral
3046,"I had the black cod with yuzu sauce, which was wonderful.",food,positive
2981,I've never had bad service and the fish is fresh and delicious.,service,positive
733,Threw my fiance's surprise 30th birthday dinner here couldn't be happier.,anecdotes,positive
4179,"All in all a wonderful experience, can't wait to come back.",anecdotes,positive
2081,"An excellent alternative to fast food joints and ordering in but, the food was slightly disappointing.",anecdotes,positive
345,Enjoy!,miscellaneous,positive
865,Great people watching as others do the same to you.,ambience,positive
2481,"I was in love with Pongsri on 48th, but compared to Suan it is slow in service and overpriced.",service,negative
3726,Salads were fantastic.,food,positive
1286,Add to that great service and great food at a reasonable price and you have yourself the beginning of a great evening.,service,positive
3991,"On a recent Saturday night, I was with a group of 5 at the Bread Bar.",anecdotes,neutral
4572,Horrible food and Horrible service.,food,negative
4488,"It is LOUD, HOT and DARK.",ambience,negative
128,"With the great variety on the menu , I eat here often and never get bored .",food,positive
3633,"We liked it so much, that we will always make it a point to dine here when we visit New York.",anecdotes,positive
911,My friend from Milan and myself were pleasantly surprised when we arrived and everyone spoke italian.,anecdotes,positive
1596,"Skip Baroanda down the street (Eurotrashy, snooty and expensive) and check this place out!",anecdotes,conflict
1169,"From beginning appetizers, the scallops were incredible, to the delicious chocolate souffle with rasberry mint sorbet, we were delighted by the taste sensations.",food,positive
1345,Been going here since it opened have seen the quality value decrease considerably.,miscellaneous,negative
4184,They are served with a free appetizer and the portions are perfect for lunch.,food,positive
906,"The second you walk through the heavy vault like door, with people anticipating your arrival you get the sense that you are going to have the dining ride of a lifetime.",service,positive
1706,Just go and see for yourself.,miscellaneous,neutral
3387,"Both times I was extremely dissappointed by the service, which was boarderline rude.",service,negative
17,"It took half an hour to get our check, which was perfect since we could sit, have drinks and talk!",service,conflict
2954,"Also, the hostess called me today to thank us for coming and mentioned how she hoped that my girlfriend enjoyed her birthday - unexpected, but a truly above and beyond thing to do...",service,positive
2513,But too far east!,anecdotes,negative
3528,"The service is friendly, if not the most prompt in the world, the food is great, and the prices, while not cheap, won't put your wallet out of commission.",food,positive
3179,...and that's saying a lot.,miscellaneous,neutral
1846,I love this place.,miscellaneous,positive
1903,The staff was the friendliest that have seen in New York.,service,positive
1489,"The crust is thin, the ingredients are fresh and the staff is friendly.",food,positive
2863,"Not the greatest sushi place, but excellent for a $19.95 all you can eat.",price,positive
1947,"So, for good food i'd recommend it, but not for a fun night out.",food,positive
3894,"In any event, even though its a bit on the pricey side, we still love this restaurant and will definitely go back.",miscellaneous,positive
1646,Went here on a friend's reccomendation.,anecdotes,neutral
3149,A bit breezy up there on the mezzanine from the wind coming from the tracks.,ambience,negative
4519,I had been a regular due to the consistently good food and ease of getting a table.,food,positive
2278,Service and food is what any one would expect when spending that type of money.,food,neutral
2345,This little place definitely exceeded my expectations and you sure get a lot of food for your money.,price,positive
3211,"I actually gave Patroon another chance before writing this, but the second visit was even worse.",anecdotes,negative
3993,Food is great and inexpensive.,food,positive
2321,Great sushi experience.,food,positive
2626,I've been eating at Taj Mahal for over twenty years and have found them to be the most excellent of the Indian eateries on this block of Indian restaurants.,anecdotes,positive
3981,And they provided a delicious dessert on the house!,price,positive
3830,A defitely must visit.,anecdotes,positive
3216,Unbelievable.,anecdotes,positive
1748,They are located in the middle of Chinatown!,anecdotes,neutral
2369,There was a great deal for 6 Blue Point oysters and a beer or glass of wine for $8!,price,positive
777,This place would be so much better served by being run by a group that actually understands customer service.,service,negative
2843,"Leon is an East Village gem: casual but hip, with well prepared basic French bistro fare, good specials, a warm and lively atmosphere.",food,positive
2821,"Seriously, this place kicks ass.",anecdotes,positive
1981,This place must have cost the owners afortune to build.,miscellaneous,negative
3436,highly recommended.,anecdotes,positive
3974,Joe's Pizza used to have the best slice until this pizzeria opened up.,miscellaneous,positive
2349,"Service was excellent, and the AC worked very well too (thank God, it was hot!).",service,positive
2924,Saul is the best restaurant on Smith Street and in Brooklyn.,anecdotes,positive
209,This was one of the BEST restaurants I've ever been to.,anecdotes,positive
3442,"I must warn the reader that the portions sizes are very small (especially the appetizers), so if you plan to eat until you are full and do not intend to order the chef's special tasting menu, prepare to order and pay for an appetizer (1 dish for each person because the portions are not for sharing), a main entree, and the cold udon at the end of the meal.",food,negative
2847,The food was absolutely horrible!,food,negative
3193,I think this is one of the more underrated places in the city.,miscellaneous,positive
2563,You cannot go wrong at the Red Eye Grill.,miscellaneous,positive
3,"To be completely fair, the only redeeming factor was the food, which was above average, but couldn't make up for all the other deficiencies of Teodora.",miscellaneous,negative
925,This is the best thing in Soho.,anecdotes,positive
3890,The dinner menu is diverse and top-notch as well.,food,positive
2977,Here's to the fake fish tanks too...,ambience,negative
3303,"In fact, while leaving the place we saw two people looking at the menu, and I couldn't help telling them that the food was horrible.",food,negative
4340,"Save your money and don't waste your calories, go to Margharita's on Washington Street instead, they have amazing food and the BEST service.",miscellaneous,negative
904,"First of all, this place is *not* romantic, as claimed by Citysearch's editorial review.",ambience,negative
228,"From the terrible service, to the bland food, not to mention the unaccommodating managers, the overall experience was horrible.",service,negative
3089,I loved everythig about it-especially the shows and actors.,anecdotes,positive
4433,"The cafe itself was really nice with comfortable outdoor chairs and tables, but the service could have been better.",ambience,positive
3898,"I don't like Indian food too much and this was delicious, however you want to factor that into the equation.",food,positive
326,Went with mommy (the only person who could afford taking me here).,anecdotes,neutral
744,The lobster sandwich is $24 and although it was good it was not nearly enough to warrant that price.,price,negative
3072,The menu prices are a bit expensive for what you get in quality and portion size.,food,negative
3740,It is simply amazing.,miscellaneous,positive
2612,"We were worried we would have trouble getting in, but somehow managed to have a short wait.",miscellaneous,positive
1319,Tends to turn people away.,anecdotes,negative
4233,You can even get packages of the chutneys to stock your fridge!,service,positive
1247,I'm amazed we haven't been kicked out of this place yet.,miscellaneous,neutral
1067,"Authentic food and they have REAL service, not just the rush you get sometimes when they try to push you out the door.",service,positive
3702,The catch is that you are charged extra for ANYTHING that you leave on your plate so don't be a greedy pig!,anecdotes,negative
2680,I am reluctant to write because I would not want my jem of a pizza place to become overcrowded.,anecdotes,positive
3969,The space is nice but when we order our drink we were in for a surprise.,miscellaneous,neutral
4180,"All in all a wonderful experience, can't wait to come back.",miscellaneous,positive
1824,JUST AWSOME.,miscellaneous,positive
1140,I would go back tho.,anecdotes,positive
2463,In summer-eat outside on a terrace (another great feature of Suan)!!!,ambience,positive
3502,Overall a disappointing experience for that price category.,miscellaneous,negative
3909,"From the street it looks very hidden, and is actually an old warehouse.",anecdotes,neutral
3441,Ambiance is barely romantic but management tries.,ambience,negative
631,"Odd for Ave B, not just odd, The place attracts an eclectic crowd to say the least.",ambience,neutral
2281,Every course was better than the next.,food,positive
648,Great Indian food and the service is incredible.,food,positive
4324,I love going there!,anecdotes,positive
4727,"Because of the delicate thin crust, take-out pies get soggy in their boxes.",food,negative
2649,"Great wine selection, Gigondas is worth the price, and the house champagne is a great value.",food,positive
3978,"Yeah the crowd can take it a bit seriously, but it shouldn't.",anecdotes,neutral
2108,The dining room is quietly elegant with no music to shout over -- how refreshing!,ambience,positive
1316,I started out with a Bombay beer which was big enough for two.,food,positive
4281,"This time, I prefer not to go into detail.",anecdotes,neutral
2166,We just ate at Kai and were disapointed.,miscellaneous,negative
3678,The makhani was OK --the korma was bland.,food,negative
837,The atmosphere is noisy and the waiters are literally walking around doing things as fast as they can.,service,conflict
247,What more can you ask for?,miscellaneous,positive
3396,The place is a BISTRO which means: simple dishes and wine served efficiently in a bustling atmosphere.,service,positive
4095,I loved this place!!,miscellaneous,positive
2884,Buon appetito!,anecdotes,positive
2666,"When we sat, we got great and fast service.",service,positive
2701,"Once you step into Cosette, you're miraculously in a small, off-the-beaten path Parisian bistro.",ambience,neutral
3481,"Well, this place is so Ghetto its not even funny.",ambience,negative
2144,"So close, but not good enough.",anecdotes,conflict
1806,"His drinks are very inventive, delicious and classy.",food,positive
1421,They even have a section in the menu called American Chinese food!,food,negative
1885,My wife and I were in NYC celebrating our 30th anniversary.,anecdotes,neutral
3524,(and I have eaten my share) Which impresses me for having such a large amount of people to serve.,service,positive
3534,"It's really a takeaway place, I wouldn't sit if I could take it home.",miscellaneous,neutral
2824,Food was good and the view of the new york city skiline was terrific even on a foggy rainy day like that of when I went.,ambience,positive
3879,The service was excellent - friendly and attentive.,service,positive
3006,And all of that won't break your bank!,price,positive
1613,"While the food was excellent, it wasn't cheap (though not extremely expensive either).",food,positive
4079,"This is a great place to take out-of-towners, and perfect for watching the sunset.",ambience,positive
3295,"Service was very good - prompt, attentive and non-intrusive.",service,positive
4332,"Great food, great decor, great service.",service,positive
112,"Pricey, but worth a try, at least once.",price,negative
3113,My fiance took me to Scopa last week for my birthday and I couldn't believe the food.,food,positive
1449,"I had a terrific meal, and our server guided us toward a very nice wine in our price range, instead of allowing us to purchase a similarly priced wine that wasn't as good.",service,positive
374,"If you're craving for Haru's great food, especially the House Roll, but can't stand the wait building outisde, head across the street to their Sake Bar!",food,positive
1386,Ruby Foo's is a tourist trap.,miscellaneous,negative
25,"He can't help, they're bought up so fast.",anecdotes,neutral
2138,Not worth it.,miscellaneous,negative
854,"We didn't even see a menu, as our waiter described both the specials and the main dishes.",service,positive
3497,It's to die for!,miscellaneous,positive
4387,I loved it and would go again.,anecdotes,positive
766,"If you'd like to have a nice light meal with an asian accent, Long Tan is a good place on the slope.",food,positive
2938,Rao's has the best service and atmosphere in NYC.,service,positive
998,I have been coming to this neighborhood spot for years.,anecdotes,neutral
3698,The duck confit is always amazing and the foie gras terrine with figs was out of this world.,food,positive
2462,When we were finally seated our waitress came by twice-1 for our order and 2-for our check.,miscellaneous,negative
2263,Please save yourself the frustration.,anecdotes,negative
3915,"The $300 bill was a bit steep, but the experience was great.",price,negative
3812,"Worth it for a special occasion, or any time!",miscellaneous,positive
726,Usually 3 vs. 4 items per dish.,food,neutral
3473,This is a fun restaurant to go to.,miscellaneous,positive
2621,"To me it exemplifies Soho, cute, artsy, interesting.",ambience,positive
4264,I've been frequenting The Tasting Room since it first arrived in the East Village and I've never been disappointed.,miscellaneous,positive
140,This place is a great bargain.,price,positive
3234,I've overheard comments from him to his employees that should not have been delivered in the dining area and I've been sitting there while he lectured another customer.,service,negative
4084,"You will pay a lot for the decore, but the food is no better or worse than a lot of other Chinese and Asian fusion places in NY.",ambience,negative
2985,What an amazing meal and experience!,anecdotes,positive
627,The atmosphere is great if your looking for a laid back scene and an inexpensive way to spend a weekend afternoon.,ambience,positive
129,The menu is very limited - i think we counted 4 or 5 entrees.,food,negative
